"Entidade Executora";"UF";"ANO";"Valor Transferido";"Valor aquisições da agricultura familiar";"Percentual.x";"Código IBGE";"Valor transferido";"Valor aquisições agricultura familiar";"Percentual.y"
"MUNICIPIO DE JUNDIAI";"SP";2011;4491780;0;0;3525904;NA;NA;NA
"MUNICIPIO DE SAO DOMINGOS";"SC";NA;NA;NA;NA;4216107;67740;51905,63;0,766247859462651
"MUNICIPIO DE SAO JOAO DA BOA VISTA";"SP";2011;873780;262635;0,300573370871386;3549102;1084500;561312,99;0,517577676348548
"PM DE CARLOS CHAGAS";"MG";2011;147660;36841,7;0,249503589326832;3113701;175600;54830;0,312243735763098
"PM DE VALENÇA";"RJ";2011;670380;269652,49;0,402238267848086;3306107;NA;NA;NA
"PREF MUN DA ESTANCIA DE SERRA NEGRA";"SP";2011;333420;68807,1;0,206367644412453;3551603;477000;393401,14;0,824740335429769
"PREF MUN DA ESTANCIA TURISTICA DE HOLAMBRA";"SP";2011;180300;0;0;3519055;265680;0;0
"PREF MUN DE ABADIA DE GOIAS";"GO";2011;82320;27000;0,32798833819242;5200050;109500;0;0
"PREF MUN DE ABADIA DOS DOURADOS";"MG";2011;38040;0;0;3100104;38540;0;0
"PREF MUN DE ABADIANIA";"GO";2011;118080;33947,1;0,28749237804878;5200100;127220;27874,4;0,219103914478856
"PREF MUN DE ABAETE";"MG";2011;172200;0;0;3100203;177503,2;20809,2;0,117232816084442
"PREF MUN DE ABAETETUBA";"PA";2011;4095480;101016;0,0246652407043863;1500107;4781398,4;524237,95;0,109641135530559
"PREF MUN DE ABAIARA";"CE";2011;148140;44442;0,3;2300101;183060;54480,7;0,297611165738009
"PREF MUN DE ABAIRA";"BA";2011;80340;18474,84;0,229958177744586;2900108;74660;22496,4;0,30131797481918
"PREF MUN DE ABARE";"BA";2011;286260;0;0;2900207;402406;0;0
"PREF MUN DE ABATIA";"PR";2011;47040;16880,27;0,358849277210884;4100103;109328;23180,76;0,212029489243378
"PREF MUN DE ABDON BATISTA";"SC";2011;18780;0;0;4200051;30660;14931,15;0,486991193737769
"PREF MUN DE ABEL FIGUEIREDO";"PA";2011;142200;0;0;1500131;154760;48877,64;0,315828637890928
"PREF MUN DE ABELARDO LUZ";"SC";2011;214440;69444,55;0,323841400858049;4200101;354584;87151,05;0,245783932721161
"PREF MUN DE ABRE CAMPO";"MG";2011;65460;11383,32;0,173897341888176;3100302;63234;28643,97;0,452983679666003
"PREF MUN DE ABREU E LIMA";"PE";2011;165024;0;0;2600054;608268;43019,96;0,0707253381733052
"PREF MUN DE ABREULANDIA";"TO";2011;22860;2034,5;0,0889982502187227;1700251;40012;19040,79;0,475876986903929
"PREF MUN DE ACAIACA";"MG";2011;42360;0;0;3100401;44920;16968,9;0,377758236865539
"PREF MUN DE ACAILANDIA";"MA";2011;1676280;218738,44;0,130490395399337;2100055;2065752;538270,31;0,260568698469129
"PREF MUN DE ACAJUTIBA";"BA";2011;179880;3057,96;0,017;2900306;219060;31330,75;0,143023600839953
"PREF MUN DE ACARA";"PA";NA;NA;NA;NA;1500206;2018845,2;671565;0,332648090106166
"PREF MUN DE ACARAPE";"CE";2011;166440;17710;0,106404710406152;2300150;91584;50718,1;0,553787779524808
"PREF MUN DE ACARAU";"CE";NA;NA;NA;NA;2300200;1086716;42770;0,0393571089410665
"PREF MUN DE ACARI";"RN";2011;95640;0;0;2400109;154912;31963,14;0,206330949184053
"PREF MUN DE ACAUA";"PI";2011;86820;0;0;2200053;92380;0;0
"PREF MUN DE ACEGUÁ";"RS";2011;42780;4481,15;0,104748714352501;4300034;49560;19527,65;0,394020379338176
"PREF MUN DE ACOPIARA";"CE";2011;760740;263608,2;0,346515498067671;2300309;884521,6;30061,4;0,0339860552868353
"PREF MUN DE ACORIZAL";"MT";2011;30660;0;0;5100102;28896;0;0
"PREF MUN DE ACRELANDIA";"AC";NA;NA;NA;NA;1200013;202180;0;0
"PREF MUN DE ACREUNA";"GO";2011;186120;22140,8;0,118959810874704;5200134;263540;63591,6;0,241297715716779
"PREF MUN DE ACUCENA";"MG";2011;49020;15209,96;0,310280701754386;3100500;50060;17476,8;0,349117059528566
"PREF MUN DE ADAMANTINA";"SP";NA;NA;NA;NA;3500105;498380;438878,23;0,880609635218107
"PREF MUN DE ADELANDIA";"GO";2011;15600;0;0;5200159;12000;0;0
"PREF MUN DE ADOLFO";"SP";2011;51300;0;0;3500204;58480;0;0
"PREF MUN DE ADRIANOPOLIS";"PR";2011;40176;2588,04;0,0644175627240143;4100202;58760;1075,52;0,0183036078965283
"PREF MUN DE ADUSTINA";"BA";2011;223800;0;0;2900355;227980;0;0
"PREF MUN DE AFOGADOS DA INGAZEIRA";"PE";2011;352680;0;0;2600104;445776;0;0
"PREF MUN DE AFONSO BEZERRA";"RN";2011;123900;0;0;2400307;206140;8292,6;0,0402280003880858
"PREF MUN DE AFONSO CLAUDIO";"ES";2011;277560;90833,35;0,327256629197291;3200102;388560;110915,97;0,285453906732551
"PREF MUN DE AFONSO CUNHA";"MA";2011;148920;0;0;2100105;294856;12349,8;0,0418841739696665
"PREF MUN DE AFRANIO";"PE";2011;289920;28047,05;0,096740652593819;2600203;381074;0;0
"PREF MUN DE AFUA";"PA";2011;986820;0;0;1500305;993560;0;0
"PREF MUN DE AGRESTINA";"PE";2011;338460;0;0;2600302;359148;0;0
"PREF MUN DE AGRICOLANDIA";"PI";2011;51462;0;0;2200103;68960;0;0
"PREF MUN DE AGROLANDIA";"SC";2011;66300;31374,62;0,473222021116139;4200200;118880;44910,12;0,377776917900404
"PREF MUN DE AGRONOMICA";"SC";2011;29280;11571,41;0,395198428961749;4200309;43600;11501,13;0,263787385321101
"PREF MUN DE AGUA AZUL DO NORTE";"PA";2011;261420;0;0;1500347;540372;0;0
"PREF MUN DE AGUA BOA";"MG";2011;73680;16663,45;0,226159744842562;3100609;25146;0;0
"PREF MUN DE AGUA BOA";"MT";2011;220680;0;0;5100201;349740;50608,67;0,144703694172814
"PREF MUN DE AGUA BRANCA";"AL";2011;296820;0;0;2700102;309544;0;0
"PREF MUN DE AGUA BRANCA";"PB";2011;129900;15270,63;0,117556812933025;2500106;178680;78276,44;0,438081710320125
"PREF MUN DE AGUA BRANCA";"PI";2011;199980;0;0;2200202;428784;650;0,00151591477293929
"PREF MUN DE AGUA CLARA";"MS";2011;154260;0;0;5000203;187660;0;0
"PREF MUN DE AGUA COMPRIDA";"MG";2011;13500;1596,4;0,118251851851852;3100708;14560;0;0
"PREF MUN DE AGUA DOCE";"SC";2011;60180;20728,52;0,344442007311399;4200408;62865,6;21284,95;0,338578650327047
"PREF MUN DE AGUA DOCE DO MARANHAO";"MA";NA;NA;NA;NA;2100154;440616;0;0
"PREF MUN DE AGUA DOCE DO NORTE";"ES";2011;115080;48315,55;0,419843152589503;3200169;135780;62498,93;0,460295551627633
"PREF MUN DE AGUA FRIA";"BA";2011;278100;82235,49;0,295704746494067;2900405;528792;88758,5;0,16785144253317
"PREF MUN DE AGUA FRIA DE GOIAS";"GO";2011;42360;0;0;5200175;43680;0;0
"PREF MUN DE AGUA LIMPA";"GO";2011;9420;3281,23;0,348325902335456;5200209;10700;0;0
"PREF MUN DE AGUA NOVA";"RN";2011;47760;0;0;2400406;94672;0;0
"PREF MUN DE AGUA PRETA";"PE";2011;377208;0;0;2600401;859872;0;0
"PREF MUN DE AGUA SANTA";"RS";2011;32304;8047;0,249102278355622;4300059;34080;10839,9;0,318072183098592
"PREF MUN DE AGUAI";"SP";2011;435660;0;0;3500303;531468;162156,82;0,305111163795374
"PREF MUN DE AGUANIL";"MG";2011;41760;0;0;3100807;50460;13909,77;0,27565933412604
"PREF MUN DE AGUAS BELAS";"PE";2011;633120;119240,89;0,188338529820571;2600500;801420;183227,6;0,228628684085748
"PREF MUN DE AGUAS DA PRATA";"SP";NA;NA;NA;NA;3500402;26076;0;0
"PREF MUN DE AGUAS DE CHAPECO";"SC";2011;22620;19402,87;0,857774977895667;4200507;32520;10008,03;0,30775
"PREF MUN DE AGUAS DE LINDOIA";"SP";2011;246000;0;0;3500501;303400;83131,32;0,273999077125906
"PREF MUN DE AGUAS DE SANTA BARBARA";"SP";2011;90900;3916,72;0,0430882288228823;3500550;109660;6995,25;0,0637903519970819
"PREF MUN DE AGUAS DE SAO PEDRO";"SP";2011;67620;0;0;3500600;86220;0;0
"PREF MUN DE AGUAS FORMOSAS";"MG";2011;66780;2697,6;0,0403953279424978;3100906;79260;6911,2;0,0871965682563714
"PREF MUN DE AGUAS FRIAS";"SC";2011;17520;6153,99;0,351255136986301;4200556;21340;8621,64;0,404013120899719
"PREF MUN DE AGUAS LINDAS DE GOIAS";"GO";2011;1741140;108008,2;0,0620330358271018;5200258;2089764;327962,16;0,156937414942549
"PREF MUN DE AGUAS MORNAS";"SC";2011;26640;6063,8;0,22762012012012;4200606;53360;54255,04;1,0167736131934
"PREF MUN DE AGUAS VERMELHAS";"MG";2011;65820;0;0;3101003;61506;0;0
"PREF MUN DE AGUDO";"RS";2011;111360;38045,39;0,341643229166667;4300109;139960;52197,2;0,372943698199486
"PREF MUN DE AGUDOS";"SP";2011;489240;0;0;3500709;486928;47160,75;0,0968536416061512
"PREF MUN DE AGUDOS DO SUL";"PR";2011;62400;19473,92;0,312082051282051;4100301;74820;19925,19;0,266308340016038
"PREF MUN DE AGUIA BRANCA";"ES";2011;98040;25663,2;0,261762545899633;3200136;131860;14494,5;0,109923403609889
"PREF MUN DE AGUIAR";"PB";2011;69540;0;0;2500205;84780;0;0
"PREF MUN DE AGUIARNOPOLIS";"TO";NA;NA;NA;NA;1700301;58768;570;0,00969915600326708
"PREF MUN DE AIMORES";"MG";2011;147900;2493,99;0,016862677484787;3101102;191596;0;0
"PREF MUN DE AIQUARA";"BA";2011;90660;0;0;2900603;83880;7146,04;0,0851936099189318
"PREF MUN DE AIUABA";"CE";2011;236760;0;0;2300408;311604;124600,27;0,399867363705216
"PREF MUN DE AIURUOCA";"MG";2011;44400;0;0;3101201;53340;19089,89;0,357890701162355
"PREF MUN DE AJURICABA";"RS";2011;87960;31938,39;0,363101296043656;4300208;102330;44960,03;0,439363138864458
"PREF MUN DE ALAGOA";"MG";2011;30240;0;0;3101300;26660;4436,6;0,166414103525881
"PREF MUN DE ALAGOA GRANDE";"PB";2011;422214;0;0;2500304;530102;85166,18;0,160659986191337
"PREF MUN DE ALAGOA NOVA";"PB";2011;217740;51910;0,238403600624598;2500403;335556;53081;0,15818820107523
"PREF MUN DE ALAGOINHA";"PB";2011;142020;26647,72;0,187633572736234;2500502;204696;38504;0,188103333724157
"PREF MUN DE ALAGOINHA";"PE";2011;193080;0;0;2600609;260602;2633,4;0,0101050644277481
"PREF MUN DE ALAGOINHA DO PIAUI";"PI";2011;86520;12336,8;0,142588996763754;2200251;128332;47757,59;0,372140931334351
"PREF MUN DE ALAGOINHAS";"BA";2011;1284600;388900;0,302740152576678;2900702;1235808;480394,32;0,388728928765633
"PREF MUN DE ALAMBARI";"SP";2011;82740;0;0;3500758;76320;0;0
"PREF MUN DE ALBERTINA";"MG";2011;37200;0;0;3101409;39860;0;0
"PREF MUN DE ALCANTARA";"MA";2011;435852;0;0;2100204;169904;226489,83;1,33304589650626
"PREF MUN DE ALCANTARAS";"CE";2011;176880;0;0;2300507;301388;27812,54;0,0922815108763454
"PREF MUN DE ALCANTIL";"PB";2011;63000;0;0;2500536;58992;11099,51;0,188152800379713
"PREF MUN DE ALCINOPOLIS";"MS";2011;NA;0;NA;5000252;59200;0;0
"PREF MUN DE ALCOBACA";"BA";2011;403200;42400;0,10515873015873;2900801;622170;123238,97;0,198079254866033
"PREF MUN DE ALDEIAS ALTAS";"MA";2011;630660;0;0;2100303;885264;0;0
"PREF MUN DE ALECRIM";"RS";2011;79860;31732,23;0,397348234410218;4300307;80100;26773,73;0,334253807740325
"PREF MUN DE ALEGRE";"ES";2011;177480;79757,24;0,449387198557584;3200201;405820;62977,72;0,155186338770884
"PREF MUN DE ALEGRETE";"RS";2011;434640;126276,96;0,290532302595251;4300406;837996;89287,29;0,106548587344092
"PREF MUN DE ALEGRETE DO PIAUI";"PI";2011;70560;0;0;2200277;111220;24798;0,222963495774141
"PREF MUN DE ALEGRIA";"RS";2011;24360;14741,65;0,605158045977012;4300455;43952;17753,76;0,403935202038588
"PREF MUN DE ALEM PARAIBA";"MG";2011;210180;0;0;3101508;257512;3220,94;0,0125079219609183
"PREF MUN DE ALENQUER";"PA";2011;1409940;0;0;1500404;1611532;93274,11;0,0578791547421956
"PREF MUN DE ALEXANDRIA";"RN";NA;NA;NA;NA;2400505;147960;0;0
"PREF MUN DE ALEXANIA";"GO";2011;216900;1779;0,00820193637621023;5200308;304216;47659,5;0,156663357614327
"PREF MUN DE ALFENAS";"MG";2011;555360;80887;0,145647868049553;3101607;850596;0;0
"PREF MUN DE ALFREDO CHAVES";"ES";2011;133500;48213,3;0,361148314606742;3200300;181940;59158,87;0,325155930526547
"PREF MUN DE ALFREDO MARCONDES";"SP";2011;45120;7009;0,155341312056738;3500808;49820;0;0
"PREF MUN DE ALFREDO VASCONCELOS";"MG";2011;43080;23236,43;0,539378597957289;3101631;49880;11158,37;0,223704290296712
"PREF MUN DE ALFREDO WAGNER";"SC";2011;62100;0;0;4200705;73900;6374,2;0,086254397834912
"PREF MUN DE ALGODAO DE JANDAIRA";"PB";2011;51780;9673,6;0,186821166473542;2500577;72152;24897,93;0,345076089366892
"PREF MUN DE ALHANDRA";"PB";2011;235920;70775,27;0,299996905730756;2500601;289008;83010,71;0,287226339755301
"PREF MUN DE ALIANCA";"PE";2011;503580;26552;0,0527264784145518;2600708;661588;0;0
"PREF MUN DE ALIANCA DO TOCANTINS";"TO";2011;46620;8667,78;0,185924066924067;1700350;66988;8133,8;0,121421747178599
"PREF MUN DE ALMADINA";"BA";NA;NA;NA;NA;2900900;100092;0;0
"PREF MUN DE ALMAS";"TO";2011;35490;11921,39;0,335908424908425;1700400;84030;10863;0,12927525883613
"PREF MUN DE ALMEIRIM";"PA";2011;699660;0;0;1500503;740236;0;0
"PREF MUN DE ALMENARA";"MG";2011;321900;96570;0,3;3101706;435000;79360,5;0,182437931034483
"PREF MUN DE ALMINO AFONSO";"RN";2011;32520;0;0;2400604;20910;0;0
"PREF MUN DE ALMIRANTE TAMANDARE";"PR";2011;605232;33523,85;0,0553900818198641;4100400;943220;79828,93;0,0846344755200271
"PREF MUN DE ALMIRANTE TAMANDARE DO SUL";"RS";2011;10200;5700,87;0,558908823529412;4300471;19300;5233,61;0,271171502590674
"PREF MUN DE ALOANDIA";"GO";2011;3120;0;0;5200506;3420;0;0
"PREF MUN DE ALPERCATA";"MG";NA;NA;NA;NA;3101805;100812;9207,42;0,0913325794548268
"PREF MUN DE ALPESTRE";"RS";2011;44520;25731,64;0,577979335130279;4300505;46240;38322,23;0,82876794982699
"PREF MUN DE ALPINOPOLIS";"MG";2011;99540;0;0;3101904;116580;32124,67;0,275559015268485
"PREF MUN DE ALTA FLORESTA";"MT";2011;494004;15845,5;0,0320756512093019;5100250;584880;98132;0,167781425249624
"PREF MUN DE ALTA FLORESTA DOESTE";"RO";2011;171240;60025,93;0,350536848867087;1100015;165240;89384;0,540934398450738
"PREF MUN DE ALTAIR";"SP";2011;55080;16524;0,3;3500907;71780;17711,5;0,246747004736695
"PREF MUN DE ALTAMIRA";"PA";2011;2074560;259122,35;0,124904726785439;1500602;2130014;432357,7;0,202983501516891
"PREF MUN DE ALTAMIRA DO MARANHAO";"MA";NA;NA;NA;NA;2100402;217100;65130;0,3
"PREF MUN DE ALTAMIRA DO PARANA";"PR";2011;37500;14716,5;0,39244;4100459;69448;46479,99;0,669277588987444
"PREF MUN DE ALTANEIRA";"CE";2011;124980;37167,7;0,297389182269163;2300606;189700;14167,8;0,0746852925672114
"PREF MUN DE ALTEROSA";"MG";2011;99480;33668,57;0,338445617209489;3102001;123740;54764,54;0,442577501212219
"PREF MUN DE ALTINHO";"PE";2011;253200;11616;0,0458767772511848;2600807;260336;77002,1;0,295779684715137
"PREF MUN DE ALTINOPOLIS";"SP";2011;204060;0;0;3501004;415444;10470,07;0,0252021211041681
"PREF MUN DE ALTO ALEGRE";"RR";2011;95940;0;0;1400050;106944;0;0
"PREF MUN DE ALTO ALEGRE";"RS";2011;9480;3524,96;0,371831223628692;4300554;14560;3395,6;0,233214285714286
"PREF MUN DE ALTO ALEGRE";"SP";2011;49260;21041,45;0,427150832318311;3501103;53680;32286,45;0,601461438152012
"PREF MUN DE ALTO ALEGRE DO MARANHAO";"MA";2011;371280;0;0;2100436;532656;268902,14;0,504832649965456
"PREF MUN DE ALTO ALEGRE DO PINDARE";"MA";2011;572232;0;0;2100477;680935,2;0;0
"PREF MUN DE ALTO ALEGRE DOS PARECIS";"RO";2011;146100;30004,43;0,205369130732375;1100379;142380;39077,74;0,274460879336986
"PREF MUN DE ALTO ARAGUAIA";"MT";2011;100500;16440;0,163582089552239;5100300;170020;17155,09;0,100900423479591
"PREF MUN DE ALTO BELA VISTA";"SC";2011;12840;0;0;4200754;16002;13732,03;0,858144606924135
"PREF MUN DE ALTO BOA VISTA";"MT";2011;40614;0;0;5100359;55560;558;0,0100431965442765
"PREF MUN DE ALTO CAPARAO";"MG";2011;45720;15884,66;0,347433508311461;3102050;63020;20582,05;0,326595525230086
"PREF MUN DE ALTO DO RODRIGUES";"RN";2011;134280;0;0;2400703;237952;30941,11;0,130030888582571
"PREF MUN DE ALTO FELIZ";"RS";2011;15600;10331,59;0,66228141025641;4300570;32980;8143,31;0,246916616130989
"PREF MUN DE ALTO GARCAS";"MT";2011;67620;0;0;5100409;99106,4;0;0
"PREF MUN DE ALTO HORIZONTE";"GO";2011;42888;0;0;5200555;98320;47857,68;0,486754271765663
"PREF MUN DE ALTO JEQUITIBA";"MG";2011;38820;0;0;3153509;36576;20480,48;0,559943132108486
"PREF MUN DE ALTO LONGA";"PI";2011;132840;25738,55;0,193756022282445;2200301;202016;26249,98;0,129940103754158
"PREF MUN DE ALTO PARAGUAI";"MT";2011;47400;8048;0,169789029535865;5100508;68624;2635,2;0,0384005595709956
"PREF MUN DE ALTO PARAISO";"RO";2011;179880;54614,16;0,303614409606404;1100403;183260;59720,44;0,325878205827786
"PREF MUN DE ALTO PARAÍSO";"PR";2011;29220;2185;0,0747775496235455;4128625;41960;6805,35;0,162186606291706
"PREF MUN DE ALTO PARAISO DE GOIAS";"GO";2011;75840;0;0;5200605;163684;29072,79;0,1776153441998
"PREF MUN DE ALTO PARANA";"PR";2011;110700;34416;0,310894308943089;4100608;145020;42016,5;0,289729002896152
"PREF MUN DE ALTO PARNAIBA";"MA";NA;NA;NA;NA;2100501;117474;7882,7;0,0671016565367656
"PREF MUN DE ALTO PIQUIRI";"PR";2011;76200;24341,92;0,319447769028871;4100707;119384;34907,5;0,292396803591771
"PREF MUN DE ALTO RIO DOCE";"MG";2011;67200;16917,5;0,251748511904762;3102100;66276;21237,8;0,32044480656648
"PREF MUN DE ALTO RIO NOVO";"ES";2011;75420;0;0;3200359;92192;8049,29;0,0873100702880944
"PREF MUN DE ALTO SANTO";"CE";2011;215040;0;0;2300705;289180;0;0
"PREF MUN DE ALTO TAQUARI";"MT";2011;94560;4143,5;0,0438187394247039;5100607;134840;34409,5;0,255187629783447
"PREF MUN DE ALTONIA";"PR";2011;174780;28100,44;0,160776061334249;4100509;183400;56103;0,305905125408942
"PREF MUN DE ALTOS";"PI";2011;471000;3175;0,00674097664543524;2200400;690600;0;0
"PREF MUN DE ALUMINIO";"SP";2011;290460;0;0;3501152;317280;90898,27;0,286492278113969
"PREF MUN DE ALVARAES";"AM";2011;234384;0;0;1300029;324846;0;0
"PREF MUN DE ALVARENGA";"MG";2011;20400;0;0;3102209;30780;9074,62;0,29482196231319
"PREF MUN DE ALVARES FLORENCE";"SP";2011;43860;0;0;3501202;53340;0;0
"PREF MUN DE ALVARES MACHADO";"SP";2011;289740;28892,31;0,0997180575688548;3501301;330980;23505,7;0,0710184905432352
"PREF MUN DE ALVARO DE CARVALHO";"SP";2011;59220;0;0;3501400;63800;10836,24;0,169847021943574
"PREF MUN DE ALVINLANDIA";"SP";2011;56100;5114,51;0,0911677361853832;3501509;74760;787,4;0,0105323702514714
"PREF MUN DE ALVINOPOLIS";"MG";2011;91320;19715,3;0,215892466053438;3102308;118400;62287,24;0,526074662162162
"PREF MUN DE ALVORADA";"RS";2011;1591260;0;0;4300604;1805033,6;0;0
"PREF MUN DE ALVORADA";"TO";2011;78000;25402,7;0,325675641025641;1700707;129524;17825;0,137619282912819
"PREF MUN DE ALVORADA DE MINAS";"MG";NA;NA;NA;NA;3102407;42060;19535,25;0,464461483594864
"PREF MUN DE ALVORADA DO GURGUEIA";"PI";2011;72180;0;0;2200459;123500;8434,51;0,0682956275303644
"PREF MUN DE ALVORADA DO NORTE";"GO";2011;94620;0;0;5200803;118960;533;0,00448049764626765
"PREF MUN DE ALVORADA DO SUL";"PR";2011;59280;0;0;4100806;105240;32959,76;0,313186621056632
"PREF MUN DE ALVORADA DOESTE";"RO";2011;148680;46831,8;0,31498385794996;1100346;141282;47860;0,338755113885704
"PREF MUN DE AMAJARI";"RR";NA;NA;NA;NA;1400027;28212;0;0
"PREF MUN DE AMAMBAI";"MS";2011;559620;14237,22;0,025440870590758;5000609;719504;48763,08;0,067773188196313
"PREF MUN DE AMAPA";"AP";2011;66900;0;0;1600105;75794;66934,24;0,883107369976515
"PREF MUN DE AMAPA DO MARANHAO";"MA";NA;NA;NA;NA;2100550;160892;83945;0,52174750764488
"PREF MUN DE AMAPORA";"PR";2011;45360;15293,17;0,337151014109347;4100905;61460;16747,24;0,272490074845428
"PREF MUN DE AMARAJI";"PE";2011;265260;0;0;2600906;329990;0;0
"PREF MUN DE AMARAL FERRADOR";"RS";2011;43860;4188,56;0,0954984040127679;4300638;73364;10085;0,137465241807971
"PREF MUN DE AMARALINA";"GO";2011;27780;0;0;5200829;32420;0;0
"PREF MUN DE AMARANTE";"PI";2011;165420;0;0;2200509;272552;0;0
"PREF MUN DE AMARANTE DO MARANHAO";"MA";2011;653460;86055;0,131691304747039;2100600;790596,8;224857,5;0,284414887588718
"PREF MUN DE AMARGOSA";"BA";2011;365520;38075;0,104166666666667;2901007;358482;60944,5;0,170007141223269
"PREF MUN DE AMATURA";"AM";2011;136896;0;0;1300060;214940;0;0
"PREF MUN DE AMELIA RODRIGUES";"BA";2011;383940;46916,45;0,122197348544043;2901106;772840;2189,5;0,00283305729517106
"PREF MUN DE AMERICA DOURADA";"BA";2011;274800;85691;0,311830422125182;2901155;447606;231640,3;0,517509372081697
"PREF MUN DE AMERICANA";"SP";2011;2572020;0;0;3501608;3393560;198028,75;0,0583542798712856
"PREF MUN DE AMERICANO DO BRASIL";"GO";2011;34860;11733,41;0,336586632243259;5200852;37540;13410,5;0,357232285562067
"PREF MUN DE AMERICO BRASILIENSE";"SP";2011;563760;89999,99;0,159642383283667;3501707;664110;223115,56;0,335961753323998
"PREF MUN DE AMERICO DE CAMPOS";"SP";2011;79020;400;0,00506200961781827;3501806;91500;21426,15;0,234165573770492
"PREF MUN DE AMETISTA DO SUL";"RS";2011;73140;22928,3;0,313485097074104;4300646;79920;23949,7;0,299670920920921
"PREF MUN DE AMONTADA";"CE";2011;789300;63359;0,0802723932598505;2300754;897372;325678,8;0,362925074551022
"PREF MUN DE AMORINOPOLIS";"GO";2011;11580;0;0;5200902;4506;0;0
"PREF MUN DE AMPARO";"PB";2011;30240;0;0;2500734;27760;2673,96;0,0963242074927954
"PREF MUN DE AMPARO";"SP";2011;827100;206368,52;0,249508547938581;3501905;1045360;497962,47;0,476355006887579
"PREF MUN DE AMPARO DA SERRA";"MG";2011;36900;16269,04;0,44089539295393;3102506;30816;672;0,0218068535825545
"PREF MUN DE AMPARO DE SAO FRANCISCO";"SE";2011;33480;0;0;2800100;46960;7430;0,158219761499148
"PREF MUN DE AMPERE";"PR";2011;132180;0;0;4101002;184980;0;0
"PREF MUN DE ANADIA";"AL";2011;244260;0;0;2700201;337088;94266;0,279648044427568
"PREF MUN DE ANAGE";"BA";2011;462180;87140,85;0,188543100090874;2901205;441816;119538;0,270560595360965
"PREF MUN DE ANAHY";"PR";2011;24000;0;0;4101051;29020;10484;0,361268090971744
"PREF MUN DE ANAJAS";"PA";2011;629520;0;0;1500701;823500;275333,1;0,334344990892532
"PREF MUN DE ANAJATUBA";"MA";2011;439140;74620,61;0,169924420458168;2100709;701436;84456;0,120404427488752
"PREF MUN DE ANALANDIA";"SP";2011;65820;0;0;3502002;71240;0;0
"PREF MUN DE ANAMA";"AM";2011;136920;41066,3;0,299929155711364;1300086;154500;37080;0,24
"PREF MUN DE ANANAS";"TO";2011;73320;28834,27;0,393266093835243;1701002;95728;14103,5;0,147328890188868
"PREF MUN DE ANANINDEUA";"PA";2011;3670020;0;0;1500800;4585068;511695,47;0,111600410288353
"PREF MUN DE ANAPOLIS";"GO";2011;2599800;749845,32;0,288424232633279;5201108;3120780;849670,01;0,272262065893783
"PREF MUN DE ANAPU";"PA";2011;400440;138308,43;0,345391144740785;1500859;497112;215517,59;0,43353930301421
"PREF MUN DE ANAPURUS";"MA";2011;208512;0;0;2100808;328380;100808;0,306985809123576
"PREF MUN DE ANASTACIO";"MS";2011;137760;259;0,00188008130081301;5000708;196440;26862,53;0,136746742007738
"PREF MUN DE ANAURILANDIA";"MS";2011;62160;18773,39;0,302017213642214;5000807;73080;112075,89;1,53360550082102
"PREF MUN DE ANCHIETA";"ES";2011;390120;231921,26;0,594486978365631;3200409;570380;312975,25;0,548713576913637
"PREF MUN DE ANCHIETA";"SC";2011;41820;32318,4;0,772797704447633;4200804;60160;35949,31;0,597561668882979
"PREF MUN DE ANDARAI";"BA";2011;191280;0;0;2901304;263040;0;0
"PREF MUN DE ANDIRA";"PR";2011;159840;40776,84;0,25511036036036;4101101;255100;59325,65;0,232558408467268
"PREF MUN DE ANDORINHA";"BA";NA;NA;NA;NA;2901353;279300;32603,75;0,116733798782671
"PREF MUN DE ANDRADAS";"MG";2011;186900;55079,8;0,294701979668272;3102605;241960;114144,35;0,471748842783931
"PREF MUN DE ANDRADINA";"SP";2011;742596;174842,25;0,235447336101999;3502101;608300;103358,28;0,169913332237383
"PREF MUN DE ANDRE DA ROCHA";"RS";2011;8160;4168,75;0,510876225490196;4300661;10180;5751,29;0,564959724950884
"PREF MUN DE ANDRELANDIA";"MG";2011;80100;0;0;3102803;75438;0;0
"PREF MUN DE ANGATUBA";"SP";2011;318360;104013;0,326715039577836;3502200;390400;151099,05;0,38703650102459
"PREF MUN DE ANGELANDIA";"MG";2011;81840;25832,33;0,315644305962854;3102852;87822;21671,8;0,246769602149803
"PREF MUN DE ANGELICA";"MS";2011;59820;24504,5;0,409637245068539;5000856;93834;34639;0,36915190655839
"PREF MUN DE ANGELIM";"PE";2011;123900;0;0;2601003;175100;0;0
"PREF MUN DE ANGELINA";"SC";2011;25200;0;0;4200903;39840;352,8;0,00885542168674699
"PREF MUN DE ANGICAL";"BA";NA;NA;NA;NA;2901403;241776;242646,53;1,00360056415856
"PREF MUN DE ANGICAL DO PIAUI";"PI";2011;56400;0;0;2200608;78280;0;0
"PREF MUN DE ANGICO";"TO";2011;25740;5498,74;0,213626262626263;1701051;31980;2785,05;0,0870872420262664
"PREF MUN DE ANGICOS";"RN";2011;96480;30116,7;0,312154850746269;2400802;111680;27160,6;0,243200214899713
"PREF MUN DE ANGRA DOS REIS";"RJ";2011;1825740;73109,69;0,0400438671442812;3300100;1694898;285475,65;0,168432348141304
"PREF MUN DE ANGUERA";"BA";2011;124260;0;0;2901502;198048;0;0
"PREF MUN DE ANGULO";"PR";2011;25980;13618,5;0,52419168591224;4101150;37620;4872,14;0,129509303561935
"PREF MUN DE ANHANGUERA";"GO";2011;9300;0;0;5201207;11040;3797,7;0,343994565217391
"PREF MUN DE ANHEMBI";"SP";2011;95700;0;0;3502309;124820;0;0
"PREF MUN DE ANHUMAS";"SP";2011;59280;17778,15;0,299901315789474;3502408;67760;0;0
"PREF MUN DE ANICUNS";"GO";2011;135780;0;0;5201306;216124;37763,66;0,174731450463623
"PREF MUN DE ANISIO DE ABREU";"PI";2011;107280;0;0;2200707;147196;0;0
"PREF MUN DE ANITA GARIBALDI";"SC";2011;73200;0;0;4201000;91480;0;0
"PREF MUN DE ANITAPOLIS";"SC";2011;23580;3626,19;0,153782442748092;4201109;32020;7846,58;0,245052467207995
"PREF MUN DE ANORI";"AM";2011;136260;40878;0,3;1300102;200260;42003,2;0,209743333666234
"PREF MUN DE ANTA GORDA";"RS";2011;54600;25787,21;0,472293223443223;4300703;55060;30638,16;0,556450417726117
"PREF MUN DE ANTAS";"BA";2011;197040;18332,9;0,0930415144133171;2901601;209620;42141,3;0,201036637725408
"PREF MUN DE ANTONINA";"PR";2011;136680;53883,45;0,394230684811238;4101200;146940;84720,4;0,576564584184021
"PREF MUN DE ANTONINA DO NORTE";"CE";2011;117480;41566,64;0,353818862785155;2300804;139220;28112,76;0,201930469760092
"PREF MUN DE ANTONIO ALMEIDA";"PI";2011;30660;0;0;2200806;48300;0;0
"PREF MUN DE ANTONIO CARDOSO";"BA";2011;185760;0;0;2901700;192860;2465,55;0,0127841439386083
"PREF MUN DE ANTONIO CARLOS";"MG";2011;49440;21946,65;0,443904733009709;3102902;53500;17714,04;0,331103551401869
"PREF MUN DE ANTONIO CARLOS";"SC";2011;44220;0;0;4201208;72840;10425;0,143121911037891
"PREF MUN DE ANTONIO DIAS";"MG";2011;52260;0;0;3103009;34776;0;0
"PREF MUN DE ANTONIO GONCALVES";"BA";2011;186840;7350;0,0393384714193963;2901809;270182;33267,8;0,123131074608967
"PREF MUN DE ANTONIO JOAO";"MS";2011;100560;0;0;5000906;152500;37071,57;0,243092262295082
"PREF MUN DE ANTONIO MARTINS";"RN";2011;119820;0;0;2400901;109900;0;0
"PREF MUN DE ANTONIO OLINTO";"PR";2011;50340;0;0;4101309;58660;12614,75;0,215048585066485
"PREF MUN DE ANTONIO PRADO";"RS";2011;53520;14394,24;0,26895067264574;4300802;78180;24686,5;0,315764901509337
"PREF MUN DE ANTONIO PRADO DE MINAS";"MG";2011;11820;740,3;0,0626311336717428;3103108;11660;9897;0,848799313893653
"PREF MUN DE APARECIDA";"PB";2011;75240;27567,9;0,366399521531101;2500775;157620;34999,55;0,222050183986804
"PREF MUN DE APARECIDA";"SP";2011;622140;0;0;3502507;NA;NA;NA
"PREF MUN DE APARECIDA DE GOIANIA";"GO";2011;2722680;359875,85;0,132177064509968;5201405;3481220;308017,29;0,0884796967729704
