"PREF MUN DE LARANJEIRAS DO SUL";"PR";2011;274620;82935,81;0,302002075595368;4113304;387624;138395,99;0,357036690194622
"PREF MUN DE LASSANCE";"MG";2011;47460;14238;0,3;3138104;53280;40365,79;0,757616178678679
"PREF MUN DE LASTRO";"PB";2011;51780;0;0;2508406;56900;0;0
"PREF MUN DE LAURENTINO";"SC";2011;35160;17930,82;0,509977815699659;4209508;66940;28329,92;0,423213624141022
"PREF MUN DE LAURO DE FREITAS";"BA";2011;2495460;0;0;2919207;2577388;0;0
"PREF MUN DE LAURO MULLER";"SC";2011;71460;22302;0,312090680100756;4209607;149620;50511,84;0,337600855500601
"PREF MUN DE LAVANDEIRA";"TO";NA;NA;NA;NA;1712157;7210;0;0
"PREF MUN DE LAVINIA";"SP";2011;70740;21910,73;0,309736075770427;3526506;73680;26748,5;0,363036102062975
"PREF MUN DE LAVRAS";"MG";2011;702786;33755,04;0,0480303250207033;3138203;942820;3655,02;0,0038766890816911
"PREF MUN DE LAVRAS DA MANGABEIRA";"CE";2011;470400;99592,9;0,211719600340136;2307502;689260;89680;0,130110553347068
"PREF MUN DE LAVRAS DO SUL";"RS";2011;66180;2765,75;0,041791326684799;4311502;79400;23004,67;0,289731360201511
"PREF MUN DE LAVRINHAS";"SP";2011;89316;5100;0,0571006314658068;3526605;94940;0;0
"PREF MUN DE LEANDRO FERREIRA";"MG";2011;12600;1620,89;0,128642063492064;3138302;16880;1213,85;0,0719105450236967
"PREF MUN DE LEBON REGIS";"SC";2011;134160;80223,1;0,597965861657722;4209706;184700;195020,92;1,05587937195452
"PREF MUN DE LEME";"SP";2011;1404900;326493,7;0,232396398320165;3526704;1723200;413134,5;0,239748433147632
"PREF MUN DE LEME DO PRADO";"MG";2011;50340;15670,6;0,31129519268971;3138351;52434;23269,8;0,443792195903421
"PREF MUN DE LENCOIS";"BA";2011;125100;4232,32;0,0338314948041567;2919306;113644;5306,5;0,0466940621590229
"PREF MUN DE LENCOIS PAULISTA";"SP";2011;856980;68605,3;0,080054727064809;3526803;1083920;53420,1;0,0492841722636357
"PREF MUN DE LEOBERTO LEAL";"SC";2011;18900;6736;0,356402116402116;4209805;28460;11233;0,394694307800422
"PREF MUN DE LEOPOLDINA";"MG";2011;327540;0;0;3138401;430880;187126,5;0,434289129223914
"PREF MUN DE LEOPOLDO DE BULHOES";"GO";NA;NA;NA;NA;5212303;97884;28444,35;0,290592435944587
"PREF MUN DE LEOPOLIS";"PR";2011;33780;8710,05;0,257846358792185;4113403;45960;30300,8;0,659286335944299
"PREF MUN DE LIBERATO SALZANO";"RS";2011;23340;0;0;4311601;24800;10566,43;0,426065725806452
"PREF MUN DE LIBERDADE";"MG";2011;27840;2601,98;0,0934619252873563;3138500;12576;3431,95;0,272896787531807
"PREF MUN DE LICINIO DE ALMEIDA";"BA";2011;150540;0;0;2919405;187248;59959,24;0,320212979577886
"PREF MUN DE LIDIANOPOLIS";"PR";2011;28800;8639,94;0,299997916666667;4113429;44160;14607,8;0,330792572463768
"PREF MUN DE LIMA CAMPOS";"MA";2011;174120;40097;0,230283712382265;2106003;179514;90762;0,505598449146028
"PREF MUN DE LIMA DUARTE";"MG";2011;99000;38142,2;0,385274747474747;3138609;110420;0;0
"PREF MUN DE LIMEIRA";"SP";2011;3633300;928965;0,255680786062257;3526902;4316688;952850;0,220736360839607
"PREF MUN DE LIMEIRA DO OESTE";"MG";2011;52440;2089;0,039836003051106;3138625;59300;3503,52;0,059081281618887
"PREF MUN DE LIMOEIRO";"PE";2011;399480;0;0;2608909;399580;5811,77;0,0145446969317784
"PREF MUN DE LIMOEIRO DE ANADIA";"AL";2011;330576;0;0;2704203;583248;290200,58;0,497559494417469
"PREF MUN DE LIMOEIRO DO AJURU";"PA";2011;592620;177379,98;0,299314872937127;1504000;674588;292777,52;0,434009380540419
"PREF MUN DE LIMOEIRO DO NORTE";"CE";2011;595200;375112,5;0,630229334677419;2307601;717580;217130;0,302586471194849
"PREF MUN DE LINDOESTE";"PR";2011;45420;16597;0,365411712901805;4113452;63200;20386,2;0,322566455696203
"PREF MUN DE LINDOIA";"SP";2011;93960;35118,2;0,373756917837378;3527009;98442;15051,56;0,15289774689665
"PREF MUN DE LINDOIA DO SUL";"SC";2011;24720;7546,3;0,305271035598705;4209854;36300;11591,74;0,319331680440771
"PREF MUN DE LINDOLFO COLLOR";"RS";2011;55020;17601,2;0,319905488913123;4311627;76560;65894,41;0,860689785788924
"PREF MUN DE LINHA NOVA";"RS";2011;5460;3178,79;0,582195970695971;4311643;12640;4124,49;0,326304588607595
"PREF MUN DE LINHARES";"ES";2011;1653480;473978,2;0,286654933836515;3203205;2463180;626799,92;0,254467769306344
"PREF MUN DE LINS";"SP";2011;899340;384177,66;0,427177330042031;3527108;1079360;493476,16;0,457193299733175
"PREF MUN DE LIVRAMENTO";"PB";NA;NA;NA;NA;2508505;38436;8315,42;0,216344572796337
"PREF MUN DE LIVRAMENTO DE NOSSA SENHORA";"BA";2011;419220;0;0;2919504;487092;113205,39;0,232410694488926
"PREF MUN DE LIZARDA";"TO";NA;NA;NA;NA;1712405;37984;9528,1;0,250845092670598
"PREF MUN DE LOANDA";"PR";2011;139920;1259,1;0,00899871355060034;4113502;229520;33249,92;0,144867201115371
"PREF MUN DE LOBATO";"PR";2011;40260;1493,4;0,0370938897168405;4113601;57980;10487,29;0,18087771645395
"PREF MUN DE LOGRADOURO";"PB";2011;50340;16397,75;0,32573996821613;2508554;121584;37635,5;0,30954319647322
"PREF MUN DE LONDRINA";"PR";2011;2674980;0;0;4113700;3987528;358074,7;0,0897986672444682
"PREF MUN DE LONTRA";"MG";2011;63300;15825,75;0,250011848341232;3138658;27138;24461,74;0,901383300169504
"PREF MUN DE LONTRAS";"SC";2011;73920;22359,71;0,302485254329004;4209904;211652;64999,5;0,307105531721883
"PREF MUN DE LORENA";"SP";2011;632160;0;0;3527207;739900;0;0
"PREF MUN DE LORETO";"MA";2011;156060;0;0;2106102;293600;0;0
"PREF MUN DE LOURDES";"SP";2011;31440;0;0;3527256;77180;0;0
"PREF MUN DE LOUVEIRA";"SP";2011;565080;0;0;3527306;890840;0;0
"PREF MUN DE LUCAS DO RIO VERDE";"MT";2011;448980;5905,1;0,0131522562252216;5105259;625260;141455,9;0,226235326104341
"PREF MUN DE LUCELIA";"SP";2011;248340;56062,39;0,225748530240799;3527405;313000;92382,5;0,295151757188498
"PREF MUN DE LUCENA";"PB";2011;158940;25811,98;0,162400780168617;2508604;212634;71968,94;0,338463933331452
"PREF MUN DE LUCIANOPOLIS";"SP";2011;36300;0;0;3527504;39680;16032,42;0,404042842741935
"PREF MUN DE LUCIARA";"MT";NA;NA;NA;NA;5105309;7704;0;0
"PREF MUN DE LUCRECIA";"RN";2011;46980;1895,6;0,0403490847169008;2406908;60260;17831,5;0,295909392631928
"PREF MUN DE LUIS ANTONIO";"SP";2011;206820;0;0;3527603;212424;0;0
"PREF MUN DE LUIS CORREIA";"PI";NA;NA;NA;NA;2205706;599784;0;0
"PREF MUN DE LUIS DOMINGUES";"MA";NA;NA;NA;NA;2106201;58392;0;0
"PREF MUN DE LUIS EDUARDO MAGALHAES";"BA";2011;764760;4173;0,00545661383963596;2919553;1130520;0;0
"PREF MUN DE LUIS GOMES";"RN";2011;201120;0;0;2407005;183380;36656;0,199890936852438
"PREF MUN DE LUISBURGO";"MG";2011;46620;8260;0,177177177177177;3138674;48060;10041,5;0,208936745734499
"PREF MUN DE LUISLANDIA";"MG";2011;50880;9224,1;0,181291273584906;3138682;15318;0;0
"PREF MUN DE LUIZ ALVES";"SC";2011;80700;26971,75;0,334222428748451;4210001;127920;54704,55;0,427646575984991
"PREF MUN DE LUIZIANA";"PR";2011;51540;33795,95;0,655722739619713;4113734;66180;49702,6;0,751021456633424
"PREF MUN DE LUIZIANIA";"SP";2011;66000;22784,53;0,345220151515152;3527702;67428;49685,25;0,736863765794625
"PREF MUN DE LUMINARIAS";"MG";2011;36450;0;0;3138708;30632;14080,18;0,459655915382606
"PREF MUN DE LUNARDELLI";"PR";2011;34560;12025,13;0,347949363425926;4113759;73672;17938,44;0,243490607014877
"PREF MUN DE LUPERCIO";"SP";2011;73680;0;0;3527801;90460;0;0
"PREF MUN DE LUPIONOPOLIS";"PR";2011;41100;12483,81;0,303742335766423;4113809;67792;26329,73;0,388389928015105
"PREF MUN DE LUTECIA";"SP";2011;43362;0;0;3527900;58500;0;0
"PREF MUN DE LUZ";"MG";2011;125460;40303,65;0,321247010999522;3138807;150820;48339,85;0,320513526057552
"PREF MUN DE LUZERNA";"SC";2011;53100;16085,44;0,302927306967985;4210035;87174;31145,8;0,357283134879666
"PREF MUN DE LUZIANIA";"GO";2011;1624920;569718,2;0,350613076336066;5212501;2163200;505166,5;0,233527413091716
"PREF MUN DE LUZILANDIA";"PI";2011;501120;0;0;2205805;598592;19252,4;0,0321628087244734
"PREF MUN DE LUZINOPOLIS";"TO";NA;NA;NA;NA;1712454;31200;0;0
"PREF MUN DE MACAE";"RJ";2011;2451600;0;0;3302403;3366948;255621,68;0,0759208874030725
"PREF MUN DE MACAIBA";"RN";2011;708180;176548,7;0,249299189471603;2407104;715540;223494,9;0,31234438326299
"PREF MUN DE MACAJUBA";"BA";2011;199800;64421,51;0,32242997997998;2919603;265356;71885,11;0,27090063914138
"PREF MUN DE MACAMBARA";"RS";2011;31968;12134,3;0,379576451451451;4311718;42220;12940,26;0,306495973472288
"PREF MUN DE MACAMBIRA";"SE";2011;88620;31302,54;0,353222071767095;2803708;115940;26619,76;0,22959944799034
"PREF MUN DE MACAPA";"AP";2011;2570760;796994,23;0,310022806485242;1600303;3364128;703093,76;0,208997327093381
"PREF MUN DE MACAPARANA";"PE";2011;250860;0;0;2609006;412504;0;0
"PREF MUN DE MACARANI";"BA";2011;268740;0;0;2919702;292260;0;0
"PREF MUN DE MACATUBA";"SP";2011;247560;0;0;3528007;316520;69123;0,218384304309364
"PREF MUN DE MACAU";"RN";2011;290580;0;0;2407203;214312;0;0
"PREF MUN DE MACAUBAL";"SP";2011;76740;32469,8;0,423114412301277;3528106;47184;0;0
"PREF MUN DE MACAUBAS";"BA";2011;591480;0;0;2919801;627660;228368,9;0,363841729598827
"PREF MUN DE MACEDONIA";"SP";2011;46380;0;0;3528205;79880;10336,35;0,129398472709064
"PREF MUN DE MACEIO";"AL";2011;4493940;0;0;2704302;5002236;4800;0,000959570879902508
"PREF MUN DE MACHACALIS";"MG";2011;49080;0;0;3138906;60300;0;0
"PREF MUN DE MACHADINHO";"RS";2011;28320;8250,36;0,291326271186441;4311700;38880;57225,2;1,47184156378601
"PREF MUN DE MACHADINHO DOESTE";"RO";2011;320880;115591,62;0,360233171278983;1100130;435402;247667,79;0,568825568095691
"PREF MUN DE MACHADO";"MG";2011;220620;71810,64;0,325494696763666;3139003;353120;111006,7;0,314359707748074
"PREF MUN DE MACHADOS";"PE";2011;120240;16604,86;0,138097638057219;2609105;184080;0;0
"PREF MUN DE MACIEIRA";"SC";2011;14100;0;0;4210050;18540;2327,08;0,125516720604099
"PREF MUN DE MACUCO";"RJ";2011;52080;0;0;3302452;88740;0;0
"PREF MUN DE MACURURE";"BA";2011;136920;0;0;2919900;231284;0;0
"PREF MUN DE MADALENA";"CE";2011;285660;83857,6;0,293557375901421;2307635;458718;0;0
"PREF MUN DE MADEIRO";"PI";2011;159600;20520;0,128571428571429;2205854;303432;0;0
"PREF MUN DE MADRE DE DEUS";"BA";2011;219960;0;0;2919926;222580;0;0
"PREF MUN DE MADRE DE DEUS DE MINAS";"MG";2011;31740;15803,07;0,497891304347826;3139102;32820;10811,55;0,329419561243144
"PREF MUN DE MAE DAGUA";"PB";2011;49800;14981,32;0,300829718875502;2508703;54414;12683,2;0,233087073179696
"PREF MUN DE MAE DO RIO";"PA";NA;NA;NA;NA;1504059;930336;64591,8;0,0694284645547415
"PREF MUN DE MAETINGA";"BA";2011;115200;30788,3;0,267259548611111;2919959;117580;15858;0,134869875829223
"PREF MUN DE MAFRA";"SC";2011;378180;176618,51;0,467022343857422;4210100;574160;344805,44;0,600538943848405
"PREF MUN DE MAGALHAES BARATA";"PA";2011;196620;0;0;1504109;242304;64523,38;0,266291022847332
"PREF MUN DE MAGALHAES DE ALMEIDA";"MA";2011;361140;95086,6;0,263295674807554;2106300;569116;215070,06;0,377901974289951
"PREF MUN DE MAGDA";"SP";2011;33720;0;0;3528304;92080;20507,11;0,22270970894874
"PREF MUN DE MAGE";"RJ";2011;3531540;0;0;3302502;3512516;0;0
"PREF MUN DE MAIQUINIQUE";"BA";2011;132120;0;0;2920007;140940;7453;0,052880658436214
"PREF MUN DE MAIRI";"BA";2011;276120;82923;0,300315080399826;2920106;319040;175110;0,548865346038114
"PREF MUN DE MAIRINQUE";"SP";2011;804060;16759,18;0,0208431957814093;3528403;896240;95000;0,105998393287512
"PREF MUN DE MAIRIPORA";"SP";2011;1011888;224998,5;0,222355142071059;3528502;1201260;0;0
"PREF MUN DE MAIRIPOTABA";"GO";2011;20160;0;0;5212600;22520;0;0
"PREF MUN DE MAJOR GERCINO";"SC";2011;15300;0;0;4210209;18100;2052,18;0,113380110497238
"PREF MUN DE MAJOR ISIDORO";"AL";2011;285780;9502,4;0,0332507523269648;2704401;403592;99654,53;0,246918992447819
"PREF MUN DE MAJOR SALES";"RN";2011;58920;0;0;2407252;85220;20740,8;0,243379488383009
"PREF MUN DE MAJOR VIEIRA";"SC";2011;51540;21256,19;0,412421226232053;4210308;58536;44976;0,768347683476835
"PREF MUN DE MALACACHETA";"MG";2011;88260;34065,75;0,385970428280082;3139201;116200;36130;0,310929432013769
"PREF MUN DE MALHADA";"BA";2011;326160;86681,04;0,265762325239146;2920205;275232;4832,45;0,0175577331124288
"PREF MUN DE MALHADA DE PEDRAS";"BA";2011;115080;29423,99;0,255682916232186;2920304;193216;43712,2;0,226234887379927
"PREF MUN DE MALHADA DOS BOIS";"SE";2011;55020;0;0;2803807;83024;31359,3;0,37771367315475
"PREF MUN DE MALHADOR";"SE";2011;144180;20140,85;0,1396923983909;2803906;147264;43396,48;0,294684919600174
"PREF MUN DE MALLET";"PR";2011;56364;49662,13;0,881096621957278;4113908;97920;61535,29;0,628424121732026
"PREF MUN DE MALTA";"PB";2011;54480;0;0;2508802;90940;12847,84;0,141278205410161
"PREF MUN DE MAMANGUAPE";"PB";2011;414060;127988,11;0,309105226295706;2508901;551070;164776,57;0,299012049285935
"PREF MUN DE MAMBAI";"GO";2011;54180;0;0;5212709;73116;437,39;0,00598213797253679
"PREF MUN DE MAMBORE";"PR";2011;109260;58803,5;0,538197876624565;4114005;146640;43992;0,3
"PREF MUN DE MAMONAS";"MG";2011;41400;9004,7;0,217504830917874;3139250;48180;5132,22;0,106521793275218
"PREF MUN DE MAMPITUBA";"RS";2011;22980;8971,5;0,390404699738903;4311734;26900;12149,14;0,451640892193309
"PREF MUN DE MANACAPURU";"AM";2011;2367600;0;0;1302504;1579060;373224,01;0,236358346104645
"PREF MUN DE MANAIRA";"PB";2011;120120;41926;0,349034299034299;2509008;129280;58253;0,450595606435644
"PREF MUN DE MANAQUIRI";"AM";2011;259860;67874;0,261194489340414;1302553;881680;383994,65;0,435526097904001
"PREF MUN DE MANARI";"PE";2011;315240;0;0;2609154;423920;0;0
"PREF MUN DE MANAUS";"AM";2011;17354700;1019322,51;0,0587346661135024;1302603;19504882,8;8039770,22;0,412192695666954
"PREF MUN DE MANCIO LIMA";"AC";2011;202140;0;0;1200336;310480;0;0
"PREF MUN DE MANDAGUACU";"PR";2011;134160;4065,9;0,0303063506261181;4114104;226300;20572,39;0,0909076005302696
"PREF MUN DE MANDAGUARI";"PR";2011;233880;38468,92;0,164481443475286;4114203;480800;47369,6;0,098522462562396
"PREF MUN DE MANDIRITUBA";"PR";2011;210360;29180,58;0,138717341699943;4114302;308380;30284,75;0,0982059472079901
"PREF MUN DE MANDURI";"SP";2011;115200;0;0;3528601;122080;78260,12;0,641056028833552
"PREF MUN DE MANFRINOPOLIS";"PR";2011;23220;6091,85;0,262353574504737;4114351;24940;7390,94;0,296348837209302
"PREF MUN DE MANGA";"MG";2011;229080;57019,88;0,248908154356557;3139300;291560;70854;0,243016874742763
"PREF MUN DE MANGARATIBA";"RJ";2011;808740;249239,41;0,308182370106586;3302601;843922;0;0
"PREF MUN DE MANGUEIRINHA";"PR";2011;138780;14679,44;0,105774895518086;4114401;222096;116928,84;0,526478819969743
"PREF MUN DE MANHUACU";"MG";2011;469440;161684,83;0,344420650136333;3139409;678336;226745,52;0,334267265779791
"PREF MUN DE MANHUMIRIM";"MG";2011;205920;53855,96;0,261538267288267;3139508;325128;129982,26;0,399787960434044
"PREF MUN DE MANICORE";"AM";2011;600840;36199,04;0,0602473869915452;1302702;948330;32867,1;0,0346578722596564
"PREF MUN DE MANOEL EMIDIO";"PI";2011;81180;26313,3;0,324135254988913;2205904;119740;49785,95;0,415783781526641
"PREF MUN DE MANOEL RIBAS";"PR";2011;85740;41182,01;0,480312689526475;4114500;122040;15703,56;0,128675516224189
"PREF MUN DE MANOEL URBANO";"AC";2011;108360;0;0;1200344;170660;49143,34;0,287960506269776
"PREF MUN DE MANOEL VIANA";"RS";2011;31980;19980,06;0,624767354596623;4311759;47680;31231,05;0,655013632550336
"PREF MUN DE MANOEL VITORINO";"BA";2011;299520;38117,83;0,127263054220085;2920403;301080;73003,5;0,242472100438422
"PREF MUN DE MANSIDAO";"BA";2011;199200;0;0;2920452;263308;0;0
"PREF MUN DE MANTENA";"MG";2011;234480;55873,71;0,238287743091095;3139607;310004;44913,74;0,144881162823706
"PREF MUN DE MANTENOPOLIS";"ES";2011;121680;35809,23;0,294290187376726;3203304;160520;83540,1;0,520434213805133
"PREF MUN DE MAQUINE";"RS";2011;45540;21412,14;0,470183135704875;4311775;58520;17006,6;0,290611756664388
"PREF MUN DE MAR DE ESPANHA";"MG";2011;58512;0;0;3139805;67240;12202,54;0,18147739440809
"PREF MUN DE MAR VERMELHO";"AL";2011;64260;0;0;2704906;78800;4575,81;0,058068654822335
"PREF MUN DE MARA ROSA";"GO";2011;57420;10335,6;0,18;5212808;76680;5213,73;0,0679933489827856
"PREF MUN DE MARAA";"AM";NA;NA;NA;NA;1302801;518060;0;0
"PREF MUN DE MARABA";"PA";2011;3358140;554629,95;0,165159865282567;1504208;4119496,8;348250,08;0,0845370434563756
"PREF MUN DE MARABA PAULISTA";"SP";NA;NA;NA;NA;3528700;17604;0;0
"PREF MUN DE MARACACUME";"MA";NA;NA;NA;NA;2106326;580148;174088,7;0,300076359825424
"PREF MUN DE MARACAI";"SP";2011;181140;69591,85;0,384188196974716;3528809;186000;1184,5;0,00636827956989247
"PREF MUN DE MARACAJA";"SC";2011;47460;14783,06;0,311484618626212;4210407;63846;34271,1;0,536777558500141
"PREF MUN DE MARACAJU";"MS";2011;314700;0;0;5005400;377064;87693,37;0,232568927290858
"PREF MUN DE MARACANA";"PA";NA;NA;NA;NA;1504307;1001992;94409,8;0,0942221095577609
"PREF MUN DE MARACANAU";"CE";2011;3674220;0;0;2307650;3881385,6;564551,97;0,145451142499215
"PREF MUN DE MARACAS";"BA";2011;376620;74503,4;0,197821145982688;2920502;473724;250851,39;0,529530676089875
"PREF MUN DE MARAGOGI";"AL";2011;525840;0;0;2704500;569636;0;0
"PREF MUN DE MARAGOGIPE";"BA";2011;527460;0;0;2920601;757112;27112,7;0,0358106858694619
"PREF MUN DE MARAIAL";"PE";NA;NA;NA;NA;2609204;234462;0;0
"PREF MUN DE MARAJA DO SENA";"MA";2011;171600;0;0;2106359;263464;0;0
"PREF MUN DE MARANGUAPE";"CE";2011;1577400;276006;0,174975275770255;2307700;1845236;399318,2;0,216404947659812
"PREF MUN DE MARANHAOZINHO";"MA";2011;258600;0;0;2106375;329060;43317,53;0,131640217589497
"PREF MUN DE MARAPANIM";"PA";2011;680760;103108,2;0,151460426582055;1504406;617460;33383,7;0,0540661743270819
"PREF MUN DE MARAPOAMA";"SP";2011;34080;0;0;3528858;67540;14758,65;0,218517175007403
"PREF MUN DE MARATA";"RS";2011;15120;7079,56;0,468224867724868;4311791;31920;20806,47;0,651831766917293
"PREF MUN DE MARATAIZES";"ES";2011;384300;74741,21;0,194486625032527;3203320;499560;13339;0,0267014973176395
"PREF MUN DE MARAU";"BA";NA;NA;NA;NA;2920700;315072;56947,3;0,180743766504164
"PREF MUN DE MARAU";"RS";2011;517560;185770,99;0,358936142669449;4311809;696740;96940,07;0,139133780176249
"PREF MUN DE MARAVILHA";"AL";NA;NA;NA;NA;2704609;225378;0;0
"PREF MUN DE MARAVILHA";"SC";2011;200520;11041,61;0,0550648813085977;4210506;263380;2348;0,008914875844787
"PREF MUN DE MARAVILHAS";"MG";2011;72360;0;0;3139706;90720;6933,85;0,0764313271604938
"PREF MUN DE MARCACAO";"PB";2011;274140;23796;0,0868023637557452;2509057;241430;87081;0,360688398293501
"PREF MUN DE MARCELANDIA";"MT";2011;147720;0;0;5105580;169900;20281,4;0,119372572101236
"PREF MUN DE MARCELINO RAMOS";"RS";2011;14580;0;0;4311908;18280;16099,45;0,880713894967177
"PREF MUN DE MARCELINO VIEIRA";"RN";2011;109980;12617;0,11472085833788;2407302;107262;32481,1;0,302820197273965
"PREF MUN DE MARCIONILIO SOUZA";"BA";2011;174600;31066;0,177926689576174;2920809;52758;26428,85;0,500944880397286
"PREF MUN DE MARCO";"CE";2011;505980;0;0;2307809;667480;104372,3;0,156367681428657
"PREF MUN DE MARCOLANDIA";"PI";2011;165300;59918,14;0,362481185722928;2205953;212240;95142;0,44827553712778
"PREF MUN DE MARCOS PARENTE";"PI";2011;42822;0;0;2206001;83070,4;0;0
"PREF MUN DE MARECHAL CANDIDO RONDON";"PR";2011;284220;113911,8;0,400787418197171;4114609;375672;0;0
"PREF MUN DE MARECHAL DEODORO";"AL";2011;689820;0;0;2704708;812880;0;0
"PREF MUN DE MARECHAL FLORIANO";"ES";2011;159900;53220,39;0,332835459662289;3203346;220080;80778,44;0,367041257724464
"PREF MUN DE MARECHAL THAUMATURGO";"AC";2011;380784;66831,5;0,175510263036262;1200351;510940;80400;0,157357028222492
"PREF MUN DE MAREMA";"SC";2011;9660;3830,3;0,396511387163561;4210555;11300;4379,6;0,387575221238938
"PREF MUN DE MARI";"PB";2011;202620;72153,5;0,356102556509723;2509107;296524;84712,45;0,28568496985067
"PREF MUN DE MARIA DA FE";"MG";2011;101400;31934,87;0,314939546351085;3139904;130428;57725,13;0,442582344281903
"PREF MUN DE MARIA HELENA";"PR";2011;37980;12157;0,320089520800421;4114708;41688;11774,6;0,282445787756669
"PREF MUN DE MARIALVA";"PR";2011;238698;12839,4;0,053789306990423;4114807;242334;23408,55;0,0965962266953874
"PREF MUN DE MARIANA";"MG";2011;486240;28259,5;0,058118418887792;NA;NA;NA;NA
"PREF MUN DE MARIANA PIMENTEL";"RS";2011;50400;0;0;4311981;51672;17123,94;0,331396888063168
"PREF MUN DE MARIANO MORO";"RS";2011;8700;4890,25;0,562097701149425;4312005;13940;3147,66;0,225800573888092
"PREF MUN DE MARIANOPOLIS DO TOCANTINS";"TO";2011;50700;9956,1;0,196372781065089;1712504;49872;0;0
"PREF MUN DE MARIAPOLIS";"SP";2011;50580;17346,06;0,342943060498221;3528908;43938;0;0
"PREF MUN DE MARIBONDO";"AL";2011;180000;0;0;2704807;241620;0;0
"PREF MUN DE MARICA";"RJ";2011;957600;0;0;3302700;1260932;154068,13;0,122185914862974
"PREF MUN DE MARILAC";"MG";2011;38220;16940,6;0,44323914181057;3140100;121396;42072,34;0,346571056706975
"PREF MUN DE MARILANDIA";"ES";2011;94440;32157,68;0,340509106310885;3203353;148180;46111,6;0,311186394925091
"PREF MUN DE MARILANDIA DO SUL";"PR";2011;33210;0;0;4114906;56736;2567,35;0,0452508107727016
"PREF MUN DE MARILENA";"PR";2011;58680;0;0;4115002;82420;30870,2;0,374547439941762
"PREF MUN DE MARILIA";"SP";2011;2981880;0;0;3529005;3439436;0;0
"PREF MUN DE MARILUZ";"PR";2011;77340;0;0;4115101;84640;28024,78;0,331105623818525
"PREF MUN DE MARINGA";"PR";2011;1893360;371008,35;0,195952354544302;4115200;3185220;669497,14;0,210188665147148
"PREF MUN DE MARINOPOLIS";"SP";2011;33360;0;0;3529104;53800;0;0
"PREF MUN DE MARIO CAMPOS";"MG";2011;94860;10149,8;0,106997680792747;3140159;112360;25921,39;0,230699448202207
"PREF MUN DE MARIOPOLIS";"PR";2011;47580;14574,84;0,306322824716267;4115309;62600;30231;0,482923322683706
"PREF MUN DE MARIPA";"PR";2011;42660;25647,6;0,601209563994374;4115358;53940;43988;0,815498702261772
"PREF MUN DE MARIPA DE MINAS";"MG";2011;36300;0;0;3140209;75796;0;0
"PREF MUN DE MARITUBA";"PA";2011;2797800;890666,79;0,31834541067982;1504422;2938668;329222,76;0,112031287644606
"PREF MUN DE MARIZOPOLIS";"PB";2011;118140;32095,5;0,27167343829355;2509156;107540;51475;0,478659103589362
"PREF MUN DE MARLIERIA";"MG";2011;34680;0;0;3140308;37040;17451,87;0,471162796976242
"PREF MUN DE MARMELEIRO";"PR";2011;94260;23225,28;0,24639592616168;4115408;103340;68585,49;0,663687729823882
"PREF MUN DE MARMELOPOLIS";"MG";2011;16320;4172,82;0,2556875;3140407;18000;10347,13;0,574840555555555
"PREF MUN DE MARQUES DE SOUZA";"RS";2011;20100;12401,31;0,616980597014925;4312054;31200;28415,82;0,910763461538462
"PREF MUN DE MARQUINHO";"PR";2011;42900;0;0;4115457;52160;0;0
"PREF MUN DE MARTINHO CAMPOS";"MG";2011;101640;25781,8;0,253658008658009;3140506;133820;40238,34;0,300690031385443
"PREF MUN DE MARTINOPOLE";"CE";2011;199380;0;0;2307908;229240;0;0
"PREF MUN DE MARTINOPOLIS";"SP";2011;321120;46813,03;0,145780487045341;3529203;373380;95625,48;0,256107665113289
"PREF MUN DE MARTINS";"RN";2011;75120;0;0;2407401;133508;0;0
"PREF MUN DE MARTINS SOARES";"MG";2011;54960;13637,1;0,248127729257642;3140530;61542;12076,36;0,196229566799909
"PREF MUN DE MARUIM";"SE";2011;176640;1720,3;0,00973901721014493;2804003;296672;3876,56;0,0130668212706288
"PREF MUN DE MARUMBI";"PR";2011;33060;23735;0,717937084089534;4115507;54200;24898,5;0,459381918819188
"PREF MUN DE MARZAGAO";"GO";2011;10140;0;0;5212907;15300;0;0
"PREF MUN DE MASCOTE";"BA";2011;254448;0;0;2920908;376902;110843,3;0,294090506285454
"PREF MUN DE MASSAPE";"CE";2011;654720;0;0;2308005;856820;28851;0,0336721831890012
"PREF MUN DE MASSAPE DO PIAUI";"PI";2011;90540;0;0;2206050;89860;0;0
"PREF MUN DE MASSARANDUBA";"PB";NA;NA;NA;NA;2509206;212416;58538,28;0,27558319523953
"PREF MUN DE MASSARANDUBA";"SC";2011;104100;17197,86;0,165205187319885;4210605;159580;82595,23;0,517578831933826
"PREF MUN DE MATA";"RS";2011;27300;13024,5;0,477087912087912;4312104;32292;40631,05;1,2582388826954
"PREF MUN DE MATA DE SAO JOAO";"BA";2011;931200;300831,55;0,323057935996564;2921005;1188320;419875,61;0,353335473609802
"PREF MUN DE MATA GRANDE";"AL";2011;524940;0;0;2705002;656020;153993,05;0,234738346391878
"PREF MUN DE MATA ROMA";"MA";2011;430440;0;0;2106409;614256;46516,4;0,0757280352165872
"PREF MUN DE MATA VERDE";"MG";2011;83100;35151,3;0,423;3140555;93726;15596;0,166399931715853
"PREF MUN DE MATAO";"SP";2011;1067700;66762,81;0,0625295588648497;3529302;1415020;229034;0,161859196336448
"PREF MUN DE MATARACA";"PB";2011;132000;40649,65;0,307951893939394;2509305;166980;70630,37;0,422987004431668
"PREF MUN DE MATEIROS";"TO";2011;20460;2851,5;0,139369501466276;1712702;28244;0;0
"PREF MUN DE MATELANDIA";"PR";2011;138540;60421;0,436126750396997;4115606;189640;60001,15;0,316395011600928
"PREF MUN DE MATERLANDIA";"MG";2011;26892;2718,16;0,101076900193366;3140605;53720;16155,15;0,300728778853313
"PREF MUN DE MATEUS LEME";"MG";2011;219720;0;0;3140704;231060;120429,57;0,521204752012464
"PREF MUN DE MATHIAS LOBATO";"MG";2011;53454;0;0;3171501;58400;0;0
"PREF MUN DE MATIAS BARBOSA";"MG";2011;80580;29426,44;0,365182923802432;3140803;20080;0;0
"PREF MUN DE MATIAS CARDOSO";"MG";2011;132480;30995,35;0,233962484903382;3140852;133280;34139,3;0,256147208883553
"PREF MUN DE MATIAS OLIMPIO";"PI";NA;NA;NA;NA;2206100;151220;0;0
"PREF MUN DE MATINA";"BA";2011;180960;54947,2;0,303642793987622;2921054;242904;91566,7;0,376966620557916
"PREF MUN DE MATINHA";"MA";2011;440160;0;0;2106508;577390;77748,5;0,134655085817212
"PREF MUN DE MATINHAS";"PB";2011;38460;11538;0,3;2509339;48820;10779,1;0,220792707906596
"PREF MUN DE MATINHOS";"PR";2011;245820;0;0;4115705;380100;0;0
"PREF MUN DE MATIPO";"MG";2011;106800;0;0;3140902;131620;65774,42;0,499729676340982
"PREF MUN DE MATO CASTELHANO";"RS";2011;9960;995,15;0,0999146586345381;4312138;9920;3123,16;0,314834677419355
"PREF MUN DE MATO GROSSO";"PB";2011;24540;7410;0,301955990220049;2509370;49188;23994,8;0,48781816703261
"PREF MUN DE MATO LEITAO";"RS";2011;53100;27872,41;0,524904143126177;4312153;102244;38593,58;0,377465474746684
"PREF MUN DE MATO QUEIMADO";"RS";2011;22320;11348;0,5084229390681;4312179;32380;13445,99;0,415256022235948
"PREF MUN DE MATO RICO";"PR";2011;35220;35220;1;4115739;35120;19660,88;0,559820045558087
"PREF MUN DE MATO VERDE";"MG";2011;63720;3608,5;0,0566305712492153;3141009;69056;0;0
"PREF MUN DE MATOES";"MA";2011;694800;0;0;2106607;1226048;375605,4;0,306354563605993
"PREF MUN DE MATOES DO NORTE";"MA";2011;427920;153254,65;0,358138553935315;2106631;466948;185905;0,398127842928977
"PREF MUN DE MATOS COSTA";"SC";2011;21120;6137,9;0,290620265151515;4210704;24220;7128;0,294302229562345
