"PREF MUN DE CONQUISTA D OESTE";"MT";2011;53940;12820;0,237671486837227;5103361;83457,6;23763,18;0,284733565307414
"PREF MUN DE CONSELHEIRO LAFAIETE";"MG";2011;730620;7667,64;0,0104947031288495;3118304;886868;51273,6;0,0578142406761773
"PREF MUN DE CONSELHEIRO MAIRINCK";"PR";2011;28980;8865,77;0,305927191166322;4106100;42000;12674,5;0,301773809523809
"PREF MUN DE CONSELHEIRO PENA";"MG";2011;129540;7034,94;0,0543070866141732;3118403;150948;1201,5;0,00795969472931076
"PREF MUN DE CONSOLACAO";"MG";2011;18000;0;0;3118502;20280;7863,72;0,387757396449704
"PREF MUN DE CONSTANTINA";"RS";2011;132120;46544,8;0,352291855888586;4305801;212552;74016,51;0,34822777485039
"PREF MUN DE CONTAGEM";"MG";2011;4701300;921478,4;0,196005019888116;3118601;4504782;0;0
"PREF MUN DE CONTENDA";"PR";2011;116160;36335,89;0,312808970385675;4106209;172600;29414,26;0,17041865585168
"PREF MUN DE CONTENDAS DO SINCORA";"BA";2011;91920;0;0;2908804;99680;8862,2;0,0889065008025682
"PREF MUN DE COQUEIRAL";"MG";2011;45660;13986,21;0,30631208935611;3118700;52540;21197,76;0,403459459459459
"PREF MUN DE COQUEIRO BAIXO";"RS";2011;4920;4001,88;0,813390243902439;4305835;13620;4619,5;0,33917033773862
"PREF MUN DE COQUEIRO SECO";"AL";2011;93300;0;0;2702207;98048;0;0
"PREF MUN DE COQUEIROS DO SUL";"RS";2011;31500;0;0;4305850;31600;11941,34;0,377890506329114
"PREF MUN DE CORACAO DE JESUS";"MG";2011;105660;0;0;3118809;152700;31695,07;0,207564309102816
"PREF MUN DE CORACAO DE MARIA";"BA";NA;NA;NA;NA;2908903;285824;28957,5;0,101312346059113
"PREF MUN DE CORBELIA";"PR";2011;117720;0;0;4106308;181980;0;0
"PREF MUN DE CORDEIRO";"RJ";2011;131940;0;0;3301504;143180;0;0
"PREF MUN DE CORDEIROPOLIS";"SP";2011;329940;0;0;3512407;510660;136069,2;0,266457525555164
"PREF MUN DE CORDEIROS";"BA";2011;125280;9248,6;0,07382343550447;2909000;183212;70929,8;0,387146038469096
"PREF MUN DE CORDILHEIRA ALTA";"SC";2011;29580;8385,26;0,283477349560514;4204350;34560;27056,55;0,782886284722222
"PREF MUN DE CORDISBURGO";"MG";2011;31500;5139,65;0,163163492063492;3118908;36680;5727,7;0,156153217011996
"PREF MUN DE CORDISLANDIA";"MG";NA;NA;NA;NA;3119005;27300;0;0
"PREF MUN DE COREAU";"CE";2011;386880;25569,9;0,0660925868486352;2304004;533744;28202,2;0,0528384394016607
"PREF MUN DE COREMAS";"PB";2011;69696;0;0;2504801;149840;0;0
"PREF MUN DE CORGUINHO";"MS";2011;43440;0;0;5003108;42240;0;0
"PREF MUN DE CORIBE";"BA";2011;219660;17883;0,0814121824638077;2909109;215520;85494,01;0,396687128804751
"PREF MUN DE CORINTO";"MG";2011;148500;14991,4;0,100952188552189;3119104;164160;27037;0,164699074074074
"PREF MUN DE CORNELIO PROCOPIO";"PR";2011;297864;42243,7;0,141822106733274;4106407;321196;98217;0,305785252618339
"PREF MUN DE COROACI";"MG";2011;102300;26499,82;0,25904027370479;3119203;107120;20818,38;0,194346340552651
"PREF MUN DE COROADOS";"SP";2011;73500;11442,49;0,155680136054422;3512506;81200;392,38;0,00483226600985222
"PREF MUN DE COROATA";"MA";2011;1043640;375480,1;0,359779330037178;2103604;1465992;66564,5;0,0454057730192252
"PREF MUN DE COROMANDEL";"MG";2011;128520;0;0;3119302;163640;0;0
"PREF MUN DE CORONEL BARROS";"RS";2011;23520;5865,94;0,249402210884354;4305871;27460;15788,21;0,574953022578296
"PREF MUN DE CORONEL BICACO";"RS";2011;NA;0;NA;4305900;18504;0;0
"PREF MUN DE CORONEL DOMINGOS SOARES";"PR";2011;65460;11135,22;0,170107241063245;4106456;135452;16296,92;0,120315093169536
"PREF MUN DE CORONEL EZEQUIEL";"RN";2011;57024;0;0;2402808;62704;14123,99;0,225248628476652
"PREF MUN DE CORONEL FABRICIANO";"MG";2011;1099200;82314,8;0,0748860989810771;3119401;1277636;225030,27;0,176130188880088
"PREF MUN DE CORONEL FREITAS";"SC";2011;49560;19675,4;0,397001614205004;4204400;105920;41647,97;0,393202133685801
"PREF MUN DE CORONEL JOAO PESSOA";"RN";2011;123420;14800;0,119915734888997;2402907;162264;37896;0,233545333530543
"PREF MUN DE CORONEL JOAO SA";"BA";2011;253440;0;0;2909208;366260;82250;0,224567247310654
"PREF MUN DE CORONEL JOSE DIAS";"PI";NA;NA;NA;NA;2202851;40860;0;0
"PREF MUN DE CORONEL MACEDO";"SP";2011;80040;0;0;3512605;96420;7415,23;0,0769055175274839
"PREF MUN DE CORONEL MARTINS";"SC";2011;16140;10604,55;0,65703531598513;4204459;37480;28116,65;0,75017742796158
"PREF MUN DE CORONEL MURTA";"MG";2011;89580;0;0;3119500;89712;28606,05;0,31886536918138
"PREF MUN DE CORONEL PACHECO";"MG";2011;32400;0;0;3119609;15350;9860,87;0,642401954397394
"PREF MUN DE CORONEL PILAR";"RS";2011;14760;5756,8;0,390027100271003;4305934;13560;0;0
"PREF MUN DE CORONEL SAPUCAIA";"MS";2011;268080;5979,05;0,0223032303789913;5003157;322800;14713,85;0,0455819392812887
"PREF MUN DE CORONEL VIVIDA";"PR";2011;132960;52869,72;0,397636281588448;4106506;196524;56222,56;0,286084956544748
"PREF MUN DE CORONEL XAVIER CHAVES";"MG";2011;21060;7493,23;0,355803893637227;3119708;24120;6351,77;0,263340381426202
"PREF MUN DE CORREGO DANTA";"MG";2011;23640;0;0;3119807;23490;0;0
"PREF MUN DE CORREGO DO BOM JESUS";"MG";2011;16620;0;0;3119906;17940;7083,22;0,394828316610925
"PREF MUN DE CORREGO DO OURO";"GO";NA;NA;NA;NA;5205703;42308;0;0
"PREF MUN DE CORREGO FUNDO";"MG";2011;47880;16951,41;0,354039473684211;3119955;61700;36749,66;0,59561847649919
"PREF MUN DE CORREGO NOVO";"MG";2011;27720;0;0;3120003;33228;0;0
"PREF MUN DE CORREIA PINTO";"SC";2011;149880;59858,12;0,399373632239125;4204558;209900;88808,89;0,423100952834683
"PREF MUN DE CORRENTE";"PI";2011;279720;0;0;2202901;466544;0;0
"PREF MUN DE CORRENTES";"PE";2011;205440;0;0;2604700;306076;63583,1;0,207736313856689
"PREF MUN DE CORRENTINA";"BA";2011;498420;89941,5;0,180453232213796;2909307;579536;130823,5;0,22573834930013
"PREF MUN DE CORTES";"PE";2011;247740;0;0;2604809;408204;123502,82;0,302551714338909
"PREF MUN DE CORUMBA";"MS";2011;1413360;81648,3;0,0577689336050263;5003207;1780928;209847,68;0,117830524310921
"PREF MUN DE CORUMBA DE GOIAS";"GO";2011;55440;0;0;5205802;90604;11557,52;0,127560814092093
"PREF MUN DE CORUMBAIBA";"GO";2011;71280;0;0;5205901;100960;39548,82;0,391727614896989
"PREF MUN DE CORUMBATAI";"SP";2011;75000;63530,74;0,847076533333333;3512704;85600;46790,12;0,546613551401869
"PREF MUN DE CORUMBATAI DO SUL";"PR";2011;29160;3171,1;0,108748285322359;4106555;32860;5387,25;0,163945526475959
"PREF MUN DE CORUMBIARA";"RO";2011;53940;13621,35;0,252527808676307;1100072;56590;3288,5;0,0581109736702598
"PREF MUN DE CORUPA";"SC";2011;125460;9000;0,0717360114777618;4204509;156882,4;24002,94;0,152999571653672
"PREF MUN DE CORURIPE";"AL";2011;904380;0;0;2702306;1021020;164241,12;0,160859846036317
"PREF MUN DE COSMOPOLIS";"SP";2011;838860;46836,08;0,0558330114679446;3512803;964000;119436;0,123896265560166
"PREF MUN DE COSMORAMA";"SP";2011;52560;0;0;3512902;102340;35823,15;0,350040551104163
"PREF MUN DE COSTA MARQUES";"RO";2011;128250;0;0;1100080;137024;33241,95;0,242599471625409
"PREF MUN DE COSTA RICA";"MS";2011;199806;2905,2;0,0145401039007838;5003256;288080;3800;0,0131907803387948
"PREF MUN DE COTEGIPE";"BA";2011;210780;31616,25;0,149996441787646;2909406;309600;0;0
"PREF MUN DE COTIA";"SP";2011;2275350;6e+05;0,263695695167776;3513009;2278928;938704,8;0,411906299804118
"PREF MUN DE COTIPORA";"RS";2011;38220;16581,15;0,433834379905809;4305959;38840;16325,98;0,420339340885685
"PREF MUN DE COTRIGUACU";"MT";2011;116280;12757,75;0,109715772273822;5103379;236944;57276,93;0,241731928219326
"PREF MUN DE COUTO DE MAGALHAES";"TO";2011;47340;0;0;1706001;79404;1608;0,0202508689738552
"PREF MUN DE COUTO DE MAGALHAES DE MINAS";"MG";2011;30060;12530,02;0,416833666001331;3120102;47562;13381,5;0,281348555569572
"PREF MUN DE COXILHA";"RS";2011;23280;9261,28;0,397821305841924;4305975;29124;13609,61;0,467298791374811
"PREF MUN DE COXIM";"MS";2011;195360;0;0;5003306;269120;52744,1;0,195987291914388
"PREF MUN DE COXIXOLA";"PB";2011;9840;2962,95;0,301112804878049;2504850;10800;15851,67;1,46774722222222
"PREF MUN DE CRAIBAS";"AL";2011;282072;0;0;2702355;452220;0;0
"PREF MUN DE CRATEUS";"CE";2011;853680;228173,03;0,267281686346172;2304103;1223508;0;0
"PREF MUN DE CRATO";"CE";2011;1428360;77999,4;0,0546076619339662;2304202;1540476;292184,52;0,189671582030489
"PREF MUN DE CRAVINHOS";"SP";2011;443460;0;0;3513108;469840;5828,2;0,0124046483909416
"PREF MUN DE CRAVOLANDIA";"BA";2011;90720;0;0;2909505;115764;30451,75;0,263050257420269
"PREF MUN DE CRICIUMA";"SC";2011;1874520;563096,42;0,300394991784564;4204608;3267116;1266080,3;0,387522297953302
"PREF MUN DE CRISOLITA";"MG";2011;58440;0;0;3120151;57744;31060,32;0,537896924355777
"PREF MUN DE CRISOPOLIS";"BA";2011;341700;77834,4;0,227785776997366;2909604;376760;109090,55;0,28954918250345
"PREF MUN DE CRISSIUMAL";"RS";2011;194880;55141,78;0,282952483579639;4306007;226760;58414,8;0,257606279767155
"PREF MUN DE CRISTAIS";"MG";2011;99540;0;0;3120201;129760;19070,65;0,146968634401973
"PREF MUN DE CRISTAIS PAULISTA";"SP";2011;124020;0;0;3513207;141320;2890,5;0,0204535805264648
"PREF MUN DE CRISTAL";"RS";2011;23700;6540;0,275949367088608;4306056;31840;12032;0,377889447236181
"PREF MUN DE CRISTAL DO SUL";"RS";2011;21300;8638,6;0,405568075117371;4306072;20880;4712,25;0,225682471264368
"PREF MUN DE CRISTALANDIA";"TO";2011;35640;11682,4;0,327789001122334;1706100;55240;22402,7;0,405552136133237
"PREF MUN DE CRISTALANDIA DO PIAUI";"PI";2011;104640;0;0;2203008;118940;0;0
"PREF MUN DE CRISTALIA";"MG";2011;60180;0;0;3120300;57480;3427,17;0,0596236951983299
"PREF MUN DE CRISTALINA";"GO";2011;635940;0;0;5206206;908332;59508,41;0,065513942038814
"PREF MUN DE CRISTIANO OTONI";"MG";2011;48000;0;0;3120409;50540;0;0
"PREF MUN DE CRISTINA";"MG";2011;66600;22677,41;0,340501651651652;3120508;88240;39523,55;0,447909678150499
"PREF MUN DE CRISTINAPOLIS";"SE";2011;265080;57278,74;0,216080956692319;2801702;465844;87305,4;0,187413383020925
"PREF MUN DE CRISTINO CASTRO";"PI";NA;NA;NA;NA;2203107;179308;0;0
"PREF MUN DE CRISTOPOLIS";"BA";2011;196680;65796,5;0,334535794183445;2909703;197740;66343,58;0,335509153433802
"PREF MUN DE CRIXAS";"GO";2011;117180;0;0;5206404;161300;2848,5;0,0176596404215747
"PREF MUN DE CRIXAS DO TOCANTINS";"TO";2011;18240;6466,9;0,354544956140351;1706258;21900;25026,47;1,14276118721461
"PREF MUN DE CROATA";"CE";2011;271680;61420,06;0,226075014723204;2304236;537168;156349,9;0,29106331724898
"PREF MUN DE CROMINIA";"GO";NA;NA;NA;NA;5206503;3288;0;0
"PREF MUN DE CRUCILANDIA";"MG";2011;33120;4170;0,125905797101449;3120607;39740;13546,38;0,340875188726724
"PREF MUN DE CRUZ";"CE";2011;385440;53618,6;0,139110107928601;2304251;523820;60400;0,115306784773395
"PREF MUN DE CRUZ ALTA";"RS";2011;372540;114277,95;0,306753502979546;4306106;453640;18500;0,0407812362225553
"PREF MUN DE CRUZ DAS ALMAS";"BA";2011;599880;105880;0,176501967060079;2909802;650720;196286,17;0,301644593680846
"PREF MUN DE CRUZ DO ESPIRITO SANTO";"PB";2011;180600;23287,5;0,128945182724252;2504900;236948;30604,3;0,129160406502693
"PREF MUN DE CRUZ MACHADO";"PR";2011;147900;60443,21;0,408676200135226;4106803;172980;39800,91;0,230089663544918
"PREF MUN DE CRUZALIA";"SP";2011;38100;17707,95;0,464775590551181;3513306;39180;15754,22;0,402098519652884
"PREF MUN DE CRUZALTENSE";"RS";2011;15960;9977,85;0,625178571428571;4306130;24000;843,99;0,03516625
"PREF MUN DE CRUZEIRO";"SP";2011;1063020;0;0;3513405;1335584;0;0
"PREF MUN DE CRUZEIRO DA FORTALEZA";"MG";2011;61320;22851,42;0,372658512720157;3120706;66200;15721,67;0,23748746223565
"PREF MUN DE CRUZEIRO DO IGUACU";"PR";2011;36420;11829,1;0,324796814936848;4106571;43840;15534,49;0,354345118613139
"PREF MUN DE CRUZEIRO DO OESTE";"PR";2011;153540;68889;0,448671355998437;4106605;305540;121011,98;0,396059370295215
"PREF MUN DE CRUZEIRO DO SUL";"AC";2011;660720;203805,09;0,308459090083545;1200203;937660;59994,7;0,0639834268284879
"PREF MUN DE CRUZEIRO DO SUL";"PR";2011;25380;0;0;4106704;43800;9995,96;0,228218264840183
"PREF MUN DE CRUZEIRO DO SUL";"RS";2011;57180;29363,59;0,513529031129766;4306205;90520;23122,87;0,255444874060981
"PREF MUN DE CRUZETA";"RN";2011;79260;0;0;2403004;110860;0;0
"PREF MUN DE CRUZILIA";"MG";2011;109200;25242,43;0,231157783882784;3120805;131620;16513,7;0,125464974927823
"PREF MUN DE CRUZMALTINA";"PR";2011;21840;0;0;4106852;24160;0;0
"PREF MUN DE CUBATAO";"SP";2011;2016180;0;0;3513504;2386120;0;0
"PREF MUN DE CUBATI";"PB";2011;104100;38572;0,370528338136407;2505006;112000;33669;0,300616071428571
"PREF MUN DE CUIABA";"MT";2011;4862880;0;0;5103403;5737920;990514,46;0,172626049160671
"PREF MUN DE CUITE";"PB";2011;236868;70172,24;0,296250401067261;2505105;358788;139970,3;0,390119792189259
"PREF MUN DE CUITE DE MAMANGUAPE";"PB";2011;143220;38213,7;0,266818181818182;2505238;173248;45927;0,265093969338751
"PREF MUN DE CUITEGI";"PB";2011;72240;0;0;2505204;99516;7702,3;0,0773976044053218
"PREF MUN DE CUJUBIM";"RO";2011;217200;0;0;1100940;250880;0;0
"PREF MUN DE CUMARI";"GO";2011;10260;0;0;5206602;15800;0;0
"PREF MUN DE CUMARU";"PE";2011;187260;0;0;2604908;266420;0;0
"PREF MUN DE CUMARU DO NORTE";"PA";2011;167880;0;0;1502764;223360;3376;0,0151146131805158
"PREF MUN DE CUMBE";"SE";2011;30720;0;0;2801900;36740;7773,38;0,211578116494284
"PREF MUN DE CUNHA";"SP";2011;302820;62906,45;0,207735453404663;3513603;323348;1034;0,00319779308979799
"PREF MUN DE CUNHA PORA";"SC";2011;66660;19619,09;0,294315781578158;4204707;100440;40327,1;0,401504380724811
"PREF MUN DE CUNHATAI";"SC";2011;8520;200;0,0234741784037559;4204756;12400;1863,5;0,150282258064516
"PREF MUN DE CUPARAQUE";"MG";2011;45420;13626;0,3;3120839;50140;16917,9;0,337413242919824
"PREF MUN DE CUPIRA";"PE";2011;311340;0;0;2605004;430264;23340,6;0,0542471598832345
"PREF MUN DE CURACA";"BA";2011;276900;4704;0,016988082340195;2909901;683928;26310,3;0,0384694002877496
"PREF MUN DE CURIMATA";"PI";2011;164820;0;0;2203206;257544;0;0
"PREF MUN DE CURIONOPOLIS";"PA";2011;361320;105399,7;0,291707350824754;1502772;526974;188440,01;0,357588818423679
"PREF MUN DE CURITIBA";"PR";2011;10163520;0;0;4106902;17735088;91919,25;0,0051829035187195
"PREF MUN DE CURITIBANOS";"SC";2011;279360;0;0;4204806;536340;36994,3;0,0689754633255025
"PREF MUN DE CURIUVA";"PR";2011;101460;28954,76;0,285381036861817;4107009;116900;26899,72;0,23010881094953
"PREF MUN DE CURRAIS";"PI";2011;140700;0;0;2203230;72488;0;0
"PREF MUN DE CURRAIS NOVOS";"RN";2011;457500;42931,16;0,0938386010928962;2403103;532180;14933,69;0,0280613514224511
"PREF MUN DE CURRAL DE CIMA";"PB";2011;89040;52485,5;0,589459793351303;2505279;57600;0;0
"PREF MUN DE CURRAL DE DENTRO";"MG";2011;60900;0;0;3120870;70240;21032,58;0,299438781321185
"PREF MUN DE CURRAL NOVO DO PIAUI";"PI";2011;81240;14195,09;0,174730305268341;2203271;80712;7381,5;0,091454802259887
"PREF MUN DE CURRAL VELHO";"PB";2011;43860;10993,68;0,25065389876881;2505303;49880;15597,58;0,31270208500401
"PREF MUN DE CURRALINHO";"PA";NA;NA;NA;NA;1502806;784020;467646,27;0,596472373153746
"PREF MUN DE CURRALINHOS";"PI";NA;NA;NA;NA;2203255;67716;0;0
"PREF MUN DE CURUA";"PA";2011;342720;0;0;1502855;346700;0;0
"PREF MUN DE CURUCA";"PA";2011;723600;0;0;1502905;723760;215245,5;0,297398999668398
"PREF MUN DE CURURUPU";"MA";NA;NA;NA;NA;2103703;402898;286470,5;0,711024874782203
"PREF MUN DE CURVELANDIA";"MT";2011;46680;0;0;5103437;90498;0;0
"PREF MUN DE CURVELO";"MG";2011;486480;0;0;3120904;627280;90686,67;0,144571275985206
"PREF MUN DE CUSTODIA";"PE";2011;485820;96171,4;0,197956856448891;2605103;589872;182819;0,309929950904603
"PREF MUN DE CUTIAS";"AP";NA;NA;NA;NA;1600212;17328;6788,7;0,391776315789474
"PREF MUN DE DAMIANOPOLIS";"GO";2011;14340;0;0;5206701;25380;2335,4;0,0920173364854216
"PREF MUN DE DAMIAO";"PB";2011;86340;4848,7;0,0561582117211026;2505352;117968;31793,8;0,269512071070121
"PREF MUN DE DAMOLANDIA";"GO";2011;14460;0;0;5206800;18120;134,5;0,00742273730684327
"PREF MUN DE DARCINOPOLIS";"TO";2011;44982;2779,19;0,0617844915744075;1706506;63200;11989,17;0,189702056962025
"PREF MUN DE DARIO MEIRA";"BA";NA;NA;NA;NA;2910008;165590,4;38868;0,234723752101571
"PREF MUN DE DATAS";"MG";2011;50100;8122,19;0,162119560878244;3121001;77172;18014,71;0,233435831648785
"PREF MUN DE DAVID CANABARRO";"RS";2011;62580;18781,5;0,300119846596357;4306304;65280;28647,44;0,438839460784314
"PREF MUN DE DAVINOPOLIS";"GO";2011;15420;0;0;5206909;17802;0;0
"PREF MUN DE DAVINOPOLIS";"MA";2011;237300;0;0;2103752;340620;88896,4;0,260984087839821
"PREF MUN DE DELFIM MOREIRA";"MG";2011;43680;16222,5;0,371394230769231;3121100;61460;11005,25;0,179063618613733
"PREF MUN DE DELFINOPOLIS";"MG";2011;65520;0;0;3121209;84080;10057,84;0,11962226450999
"PREF MUN DE DELMIRO GOUVEIA";"AL";2011;627780;126056;0,200796457357673;2702405;717748;92065;0,128269253275523
"PREF MUN DE DELTA";"MG";2011;101220;21104,45;0,208500790357637;3121258;135060;28106,92;0,208106915444987
"PREF MUN DE DEMERVAL LOBAO";"PI";2011;124020;7596,12;0,0612491533623609;2203305;124820;0;0
"PREF MUN DE DENISE";"MT";2011;56280;0;0;5103452;72774;0;0
"PREF MUN DE DEODAPOLIS";"MS";2011;33780;0;0;5003454;55400;0;0
"PREF MUN DE DEPUTADO IRAPUAN PINHEIRO";"CE";2011;124140;0;0;2304269;156720;51411,4;0,328046197039306
"PREF MUN DE DERRUBADAS";"RS";2011;30060;0;0;4306320;39500;25447,29;0,644235189873418
"PREF MUN DE DESCALVADO";"SP";2011;358620;132484,5;0,369428643132006;3513702;433100;179303,3;0,413999769106442
"PREF MUN DE DESCANSO";"SC";2011;53040;22379,6;0,421938159879336;4204905;71790;25784,65;0,359167711380415
"PREF MUN DE DESCOBERTO";"MG";2011;34740;14845,35;0,427327288428325;3121308;45840;15143,94;0,330365183246073
"PREF MUN DE DESTERRO";"PB";2011;96780;13479,73;0,139282186402149;2505402;122240;24677,1;0,201874181937173
"PREF MUN DE DESTERRO DE ENTRE RIOS";"MG";2011;22140;5330,67;0,240771002710027;3121407;23400;6541,72;0,279560683760684
"PREF MUN DE DESTERRO DO MELO";"MG";2011;35280;20713,75;0,587124433106576;3121506;35320;12656,42;0,358335787089468
"PREF MUN DE DEZESSEIS DE NOVEMBRO";"RS";2011;13740;0;0;4306353;15700;8783,05;0,559429936305732
"PREF MUN DE DIADEMA";"SP";2011;2576340;306544,45;0,11898447021744;3513801;4042888;859498,84;0,212595263583854
"PREF MUN DE DIAMANTE";"PB";2011;113820;3466;0,030451590230188;2505600;132390;9553,51;0,0721618702318906
"PREF MUN DE DIAMANTE DO NORTE";"PR";2011;45360;18031,25;0,397514329805996;4107108;56420;16390,4;0,290506912442396
"PREF MUN DE DIAMANTE DO SUL";"PR";2011;33900;29973,86;0,884184660766962;4107124;29016;13714,97;0,472669216983733
"PREF MUN DE DIAMANTE DOESTE";"PR";2011;34500;19992,22;0,579484637681159;4107157;41940;14510,42;0,345980448259418
"PREF MUN DE DIAMANTINA";"MG";2011;259380;78493,9;0,302621250674686;3121605;374380;95613,18;0,255390726000321
"PREF MUN DE DIAMANTINO";"MT";2011;187860;0;0;5103502;304408;109457,33;0,35957441985756
"PREF MUN DE DIANOPOLIS";"TO";2011;121260;33087,7;0,272865743031503;1707009;234764;52928,5;0,225454073026529
"PREF MUN DE DIAS DAVILA";"BA";2011;948720;163544,71;0,172384591871153;2910057;1069340;93979,17;0,0878852095685189
"PREF MUN DE DILERMANDO DE AGUIAR";"RS";2011;21168;22906,1;1,08210978835979;4306379;54200;17591,07;0,324558487084871
"PREF MUN DE DIOGO DE VASCONCELOS";"MG";2011;28920;20600;0,712309820193638;3121704;33200;13624,72;0,41038313253012
"PREF MUN DE DIONISIO";"MG";2011;32400;2647,9;0,0817253086419753;3121803;38860;12530,38;0,322449305198147
"PREF MUN DE DIONISIO CERQUEIRA";"SC";2011;76596;24182,99;0,315721317040054;4205001;136384;53080;0,389195213514782
"PREF MUN DE DIORAMA";"GO";2011;8880;4687,6;0,527882882882883;5207105;13580;2973,2;0,218939617083947
"PREF MUN DE DIRCE REIS";"SP";2011;21600;8800,64;0,407437037037037;3513850;26520;8873,5;0,33459653092006
"PREF MUN DE DIRCEU ARCOVERDE";"PI";2011;89100;0;0;2203354;47780;0;0
"PREF MUN DE DIVINA PASTORA";"SE";2011;84180;32919,9;0,391065573770492;2802007;194780;21437,9;0,110062121367697
"PREF MUN DE DIVINESIA";"MG";2011;27120;17737,52;0,654038348082596;3121902;40420;9318,2;0,230534388916378
"PREF MUN DE DIVINO";"MG";2011;129360;0;0;3122009;137260;50572,2;0,368440915051727
"PREF MUN DE DIVINO DAS LARANJEIRAS";"MG";2011;25080;12306,88;0,490704944178628;3122108;51340;12429,37;0,242099142968446
"PREF MUN DE DIVINO DE SAO LOURENCO";"ES";2011;20196;10421,65;0,516025450584274;3201803;26180;19572,71;0,747620702826585
"PREF MUN DE DIVINOLANDIA";"SP";2011;141300;0;0;3513900;142540;0;0
"PREF MUN DE DIVINOLANDIA DE MINAS";"MG";2011;58800;14882,3;0,253100340136054;3122207;62040;17010,48;0,274185686653772
"PREF MUN DE DIVINOPOLIS";"MG";2011;1133940;380689,65;0,335722921847717;3122306;1450920;539659,51;0,371942981005155
"PREF MUN DE DIVINOPOLIS DE GOIAS";"GO";2011;24300;0;0;5208301;72378;0;0
"PREF MUN DE DIVINOPOLIS DO TOCANTINS";"TO";2011;64500;19553,16;0,30314976744186;1707108;110440;41115,9;0,372291742122419
"PREF MUN DE DIVISA ALEGRE";"MG";NA;NA;NA;NA;3122355;96138;20606,14;0,214339179096715
"PREF MUN DE DIVISA NOVA";"MG";2011;52740;10112,74;0,191747061054228;3122405;68640;6367,93;0,092772872960373
"PREF MUN DE DIVISOPOLIS";"MG";2011;86520;5707,4;0,0659662505779011;3122454;86922;23187,34;0,266760313844596
"PREF MUN DE DOBRADA";"SP";2011;136320;13505;0,0990683685446009;3514007;168200;75832,98;0,450850059453032
"PREF MUN DE DOIS CORREGOS";"SP";2011;256620;0;0;3514106;360860;0;0
"PREF MUN DE DOIS IRMAOS";"RS";2011;256020;176535,9;0,689539489102414;4306403;369400;305917,32;0,828146507850569
"PREF MUN DE DOIS IRMAOS DAS MISSOES";"RS";2011;42474;12405,5;0,292072797476103;4306429;39440;11369,95;0,288284736308316
"PREF MUN DE DOIS IRMAOS DO BURITI";"MS";2011;138960;53378,15;0,384126007484168;5003488;152740;44993,75;0,294577386408276
"PREF MUN DE DOIS IRMAOS DO TOCANTINS";"TO";2011;44340;5269,4;0,118840775823184;1707207;67932;7057,7;0,103893599481835
"PREF MUN DE DOIS LAJEADOS";"RS";2011;28560;13688,4;0,479285714285714;4306452;26600;16922,46;0,636182706766917
"PREF MUN DE DOIS RIACHOS";"AL";2011;231660;40500;0,174825174825175;2702504;353180;32471,5;0,0919403703493969
"PREF MUN DE DOIS VIZINHOS";"PR";2011;243420;226682,38;0,931239750225947;4107207;320660;97210,64;0,303157986652529
"PREF MUN DE DOLCINOPOLIS";"SP";2011;31620;6058,5;0,191603415559772;3514205;50900;2548;0,0500589390962672
"PREF MUN DE DOM AQUINO";"MT";2011;43080;0;0;5103601;56880;2531,79;0,0445110759493671
"PREF MUN DE DOM BASILIO";"BA";2011;132894;0;0;2910107;208572;51027,35;0,244651007805458
"PREF MUN DE DOM BOSCO";"MG";2011;36936;0;0;3122470;34040;14324,6;0,420816686251469
"PREF MUN DE DOM CAVATI";"MG";2011;35160;22229,48;0,632237770193402;3122504;39280;16697,2;0,425081466395112
"PREF MUN DE DOM ELISEU";"PA";2011;786900;124840,95;0,158649065955013;1502939;1711848;258936,86;0,151261595655689
"PREF MUN DE DOM EXPEDITO LOPES";"PI";2011;87960;0;0;2203404;114608;0;0
"PREF MUN DE DOM FELICIANO";"RS";2011;180480;82217,65;0,455549922429078;4306502;124836;73701,44;0,590386106571822
"PREF MUN DE DOM INOCENCIO";"PI";NA;NA;NA;NA;2203453;75530;0;0
"PREF MUN DE DOM JOAQUIM";"MG";2011;21240;11723,13;0,551936440677966;3122603;34560;12060,19;0,348963831018519
"PREF MUN DE DOM MACEDO COSTA";"BA";2011;37080;7280,46;0,196344660194175;2910206;61300;0;0
"PREF MUN DE DOM PEDRITO";"RS";2011;239520;0;0;4306601;284560;69405,7;0,243905327523194
"PREF MUN DE DOM PEDRO";"MA";NA;NA;NA;NA;2103802;208170;0;0
"PREF MUN DE DOM PEDRO DE ALCANTARA";"RS";2011;13620;0;0;4306551;20520;10627,93;0,517930311890838
"PREF MUN DE DOM SILVERIO";"MG";2011;38220;20195,2;0,528393511250654;3122702;50160;26444,38;0,527200558213716
"PREF MUN DE DOM VICOSO";"MG";2011;21636;10718,07;0,495381308929562;3122801;16980;9347,02;0,550472320376914
"PREF MUN DE DOMINGOS MARTINS";"ES";2011;328680;102997,61;0,313367439454789;3201902;413617,6;80968,35;0,195756539373566
"PREF MUN DE DOMINGOS MOURAO";"PI";2011;75300;9890;0,131341301460823;2203420;99120;3000;0,0302663438256659
"PREF MUN DE DONA EMMA";"SC";2011;21780;17974,55;0,825277777777778;4205100;35280;45177,35;1,28053713151927
"PREF MUN DE DONA EUZEBIA";"MG";2011;42000;0;0;3122900;39720;15829,64;0,398530715005035
"PREF MUN DE DONA FRANCISCA";"RS";2011;52380;18257,8;0,34856433753341;4306700;74176;26973,72;0,363644844693702
"PREF MUN DE DONA INES";"PB";2011;136200;0;0;2505709;205080;0;0
"PREF MUN DE DORES DE CAMPOS";"MG";2011;59700;4201,4;0,0703752093802345;3123007;66560;7704,85;0,115757962740385
"PREF MUN DE DORES DE GUANHAES";"MG";2011;44460;0;0;3123106;47660;9034,21;0,189555392362568
"PREF MUN DE DORES DO INDAIA";"MG";2011;112380;0;0;3123205;126040;0;0
"PREF MUN DE DORES DO RIO PRETO";"ES";2011;42900;18821,75;0,438735431235431;3202009;14376;15800,05;1,09905745687257
"PREF MUN DE DORES DO TURVO";"MG";2011;32640;26194,47;0,802526654411765;3123304;23664;6727,8;0,284305273833671
"PREF MUN DE DORESOPOLIS";"MG";NA;NA;NA;NA;3123403;22540;0;0
"PREF MUN DE DORMENTES";"PE";2011;254880;40061,28;0,157177024482109;2605152;286100;63070,97;0,220450786438308
"PREF MUN DE DOURADINA";"MS";2011;53220;13353,35;0,250908493047726;5003504;70060;45204,32;0,645222951755638
"PREF MUN DE DOURADINA";"PR";2011;50760;15228,14;0,300002758077226;4107256;82820;24932,89;0,30104914271915
"PREF MUN DE DOURADO";"SP";2011;110400;0;0;3514304;74424;0;0
"PREF MUN DE DOURADOQUARA";"MG";2011;4980;0;0;3123502;4100;0;0
"PREF MUN DE DOURADOS";"MS";2011;2185440;777785,85;0,355894396551724;5003702;2573472;830964,84;0,322896398328795
"PREF MUN DE DOUTOR CAMARGO";"PR";2011;39300;12000;0,305343511450382;4107306;57640;0;0
"PREF MUN DE DOUTOR MAURICIO CARDOSO";"RS";2011;32040;12153,4;0,379319600499376;4306734;39260;19534,3;0,497562404482934
"PREF MUN DE DOUTOR PEDRINHO";"SC";2011;22800;6161,21;0,27022850877193;4205159;33480;24001,74;0,716897849462366
"PREF MUN DE DOUTOR RICARDO";"RS";2011;22380;7179,9;0,320817694369973;4306759;24440;9336,6;0,382021276595745
"PREF MUN DE DOUTOR SEVERIANO";"RN";2011;113520;34534,7;0,304216878083157;2403202;160296;45584;0,284373908269701
"PREF MUN DE DOUTOR ULYSSES";"PR";NA;NA;NA;NA;4128633;24970;4419,6;0,17699639567481
"PREF MUN DE DOVERLANDIA";"GO";2011;46260;0;0;5207253;48820;2929,16;0,0599991806636624
"PREF MUN DE DRACENA";"SP";2011;528420;225494,99;0,426734396881269;3514403;768120;324869,75;0,422941402385044
"PREF MUN DE DUARTINA";"SP";2011;147180;0;0;3514502;161260;2124;0,0131712761999256
"PREF MUN DE DUAS BARRAS";"RJ";2011;117360;12934,81;0,110214809134288;3301603;156140;34983,05;0,224049250672473
