"PREF MUN DE REGENTE FEIJO";"SP";2011;230640;34864,96;0,151166146375304;3542404;316220;0;0
"PREF MUN DE REGINOPOLIS";"SP";2011;61440;0;0;3542503;68310;6143,77;0,0899395403308447
"PREF MUN DE REGISTRO";"SP";2011;744894;361483,79;0,485282187801217;3542602;958380;337057,91;0,351695475698575
"PREF MUN DE RELVADO";"RS";2011;22020;9542,9;0,433374205267938;4315453;22700;12187,75;0,536905286343612
"PREF MUN DE REMANSO";"BA";2011;562740;189060,36;0,335963962042862;2926004;627478,4;0;0
"PREF MUN DE REMIGIO";"PB";2011;190680;44234,8;0,231984476610027;2512705;268788;92477,65;0,344054236052205
"PREF MUN DE RENASCENCA";"PR";2011;48960;17057,6;0,348398692810457;4121604;64760;19862,2;0,306704756022236
"PREF MUN DE RERIUTABA";"CE";2011;327360;92700,18;0,283175036656891;2311702;430602,4;144023;0,334468642069807
"PREF MUN DE RESENDE";"RJ";2011;1114380;0;0;3304201;1403976;0;0
"PREF MUN DE RESENDE COSTA";"MG";2011;72060;20391,66;0,282981681931724;3154200;87360;30767,09;0,352187385531136
"PREF MUN DE RESERVA";"PR";2011;219840;1850;0,00841521106259097;4121703;244820;75146,7;0,306946736377747
"PREF MUN DE RESERVA DO CABACAL";"MT";2011;16380;4914;0,3;5107156;35140;0;0
"PREF MUN DE RESERVA DO IGUACU";"PR";2011;84240;28231,9;0,335136514719848;4121752;98780;26515,6;0,268430856448674
"PREF MUN DE RESPLENDOR";"MG";2011;158880;0;0;3154309;170380;0;0
"PREF MUN DE RESSAQUINHA";"MG";2011;55500;18748,9;0,337818018018018;3154408;61140;3079,6;0,0503696434412823
"PREF MUN DE RESTINGA";"SP";2011;118740;16987,31;0,143063078996126;3542701;139000;100175,78;0,720689064748201
"PREF MUN DE RESTINGA SECA";"RS";2011;104760;48807,47;0,465897957235586;4315503;173684;171327,01;0,986429435065982
"PREF MUN DE RETIROLANDIA";"BA";2011;164160;50002,8;0,304597953216374;2926103;220196;70476;0,32006030990572
"PREF MUN DE RIACHAO";"MA";2011;302340;0;0;2109502;395684;45878,43;0,115947144691218
"PREF MUN DE RIACHAO";"PB";2011;53580;4859;0,0906868234415827;2512747;22608;0;0
"PREF MUN DE RIACHAO DAS NEVES";"BA";2011;321240;0;0;2926202;586328;0;0
"PREF MUN DE RIACHAO DO BACAMARTE";"PB";2011;57600;13858;0,240590277777778;2512754;83860;18216;0,217219174815168
"PREF MUN DE RIACHAO DO DANTAS";"SE";2011;291780;68867,74;0,236026252656111;2805802;306834,4;20713,8;0,0675080760175521
"PREF MUN DE RIACHAO DO JACUIPE";"BA";NA;NA;NA;NA;2926301;279448;36070;0,129075892473734
"PREF MUN DE RIACHAO DO POCO";"PB";2011;64380;19902,45;0,309140260950606;2512762;56160;11417,1;0,20329594017094
"PREF MUN DE RIACHINHO";"MG";2011;59160;2758,8;0,046632860040568;3154457;61560;13477,25;0,218928687459389
"PREF MUN DE RIACHINHO";"TO";2011;66660;0;0;1718550;92106;0;0
"PREF MUN DE RIACHO DA CRUZ";"RN";2011;41760;0;0;2410702;53840;12473,92;0,23168499257058
"PREF MUN DE RIACHO DAS ALMAS";"PE";2011;280038;0;0;2611705;279160;8226;0,0294669723456083
"PREF MUN DE RIACHO DE SANTANA";"BA";2011;398220;0;0;2926400;919580;92109,5;0,1001647491246
"PREF MUN DE RIACHO DE SANTANA";"RN";2011;40194;0;0;2410801;77092;0;0
"PREF MUN DE RIACHO DE SANTO ANTONIO";"PB";2011;33480;7542;0,225268817204301;2512788;40100;21182,14;0,528232917705736
"PREF MUN DE RIACHO DOS CAVALOS";"PB";2011;69420;16595,84;0,239064246614808;2512804;112680;23358,3;0,207297657082002
"PREF MUN DE RIACHO DOS MACHADOS";"MG";NA;NA;NA;NA;3154507;24564;0;0
"PREF MUN DE RIACHO FRIO";"PI";2011;90840;0;0;2208858;93180;0;0
"PREF MUN DE RIACHUELO";"RN";2011;90480;0;0;2410900;95920;34824,45;0,363057235195997
"PREF MUN DE RIACHUELO";"SE";2011;102780;0;0;2805901;109170;43086,22;0,394670880278465
"PREF MUN DE RIALMA";"GO";2011;58800;34374,8;0,584605442176871;5218607;106900;34305,15;0,320908793264733
"PREF MUN DE RIANAPOLIS";"GO";2011;30000;9856,37;0,328545666666667;5218706;42740;13645,36;0,319264389330838
"PREF MUN DE RIBAMAR FIQUENE";"MA";NA;NA;NA;NA;2109551;140300;0;0
"PREF MUN DE RIBAS DO RIO PARDO";"MS";2011;206580;23579,8;0,114143673153258;5007109;325840;62016,9;0,190329302725264
"PREF MUN DE RIBEIRA";"SP";2011;59520;0;0;3542800;67240;0;0
"PREF MUN DE RIBEIRA DO AMPARO";"BA";2011;266160;80791,71;0,303545649233544;2926509;421072;3688,2;0,0087590720826842
"PREF MUN DE RIBEIRA DO PIAUI";"PI";NA;NA;NA;NA;2208874;85020;0;0
"PREF MUN DE RIBEIRA DO POMBAL";"BA";2011;758160;0;0;2926608;853300;190960,25;0,223790284776749
"PREF MUN DE RIBEIRAO";"PE";2011;665880;0;0;2611804;608668;0;0
"PREF MUN DE RIBEIRAO BONITO";"SP";2011;190020;0;0;3542909;310076;0;0
"PREF MUN DE RIBEIRAO BRANCO";"SP";2011;445134;0;0;3543006;301712;0;0
"PREF MUN DE RIBEIRAO CASCALHEIRA";"MT";2011;102060;16582,5;0,162477954144621;5107180;149322;2792;0,0186978476045057
"PREF MUN DE RIBEIRAO CLARO";"PR";2011;82800;38539,64;0,465454589371981;4121802;110320;40365,52;0,365894851341552
"PREF MUN DE RIBEIRAO CORRENTE";"SP";2011;90360;0;0;3543105;123956,8;16842,89;0,135877095891472
"PREF MUN DE RIBEIRAO DAS NEVES";"MG";2011;1748280;250695,9;0,143395737524882;3154606;2009196;0;0
"PREF MUN DE RIBEIRAO DO LARGO";"BA";2011;163620;0;0;2926657;198378;32660,5;0,164637711843047
"PREF MUN DE RIBEIRAO DO PINHAL";"PR";2011;112920;0;0;4121901;159260;50018,97;0,314071141529574
"PREF MUN DE RIBEIRAO DO SUL";"SP";2011;71880;0;0;3543204;75640;3639,95;0,048122025383395
"PREF MUN DE RIBEIRAO DOS INDIOS";"SP";2011;26568;0;0;3543238;35560;10931,23;0,307402418447694
"PREF MUN DE RIBEIRAO GRANDE";"SP";2011;127260;66459,92;0,52223730944523;3543253;134800;89496,31;0,663919213649852
"PREF MUN DE RIBEIRAO PIRES";"SP";2011;1673760;170546,51;0,101894244097123;3543303;1940572;473563,31;0,244032847016241
"PREF MUN DE RIBEIRAO PRETO";"SP";2011;2927520;741185,5;0,25317862901022;3543402;4590816;927379,92;0,202007643085674
"PREF MUN DE RIBEIRAO VERMELHO";"MG";NA;NA;NA;NA;3154705;23712;4246,11;0,179070091093117
"PREF MUN DE RIBEIRAOZINHO";"MT";2011;16080;6312;0,392537313432836;5107198;23740;7588,08;0,319632687447346
"PREF MUN DE RIBEIRO GONCALVES";"PI";2011;82680;16468,41;0,199182510885341;2208908;116100;0;0
"PREF MUN DE RIBEIROPOLIS";"SE";2011;161520;96917,69;0,600035227835562;2806008;208060;181843,36;0,873994809189657
"PREF MUN DE RIFAINA";"SP";2011;48480;17105,5;0,352836221122112;3543600;53520;20348,38;0,380201420029895
"PREF MUN DE RINCAO";"SP";2011;165120;66687,42;0,403872456395349;3543709;214200;53659,92;0,250513165266106
"PREF MUN DE RINOPOLIS";"SP";2011;112620;0;0;3543808;155080;55508,2;0,357932679907145
"PREF MUN DE RIO ACIMA";"MG";2011;137460;0;0;3154804;220124;0;0
"PREF MUN DE RIO AZUL";"PR";2011;93900;33820,01;0,360170500532481;4122008;105640;44895,62;0,424986936766376
"PREF MUN DE RIO BANANAL";"ES";2011;208200;69012;0,331469740634006;3204351;284580;154232,49;0,54196531730972
"PREF MUN DE RIO BOM";"PR";2011;30900;0;0;4122107;29400;0;0
"PREF MUN DE RIO BONITO";"RJ";2011;623640;0;0;3304300;447442;155815,95;0,34823720169318
"PREF MUN DE RIO BONITO DO IGUACU";"PR";2011;124860;32696,54;0,261865609482621;4122156;223428;66850,46;0,299203591313533
"PREF MUN DE RIO BRANCO";"AC";2011;1316700;517869,68;0,393308787119313;1200401;1871916;736400,7;0,393394094606809
"PREF MUN DE RIO BRANCO";"MT";2011;47160;0;0;5107206;55500;3403,08;0,0613167567567568
"PREF MUN DE RIO BRANCO DO IVAI";"PR";2011;29580;0;0;4122172;37100;27705,6;0,74678167115903
"PREF MUN DE RIO BRANCO DO SUL";"PR";2011;301920;0;0;4122206;331812;36878,69;0,111143328149675
"PREF MUN DE RIO BRILHANTE";"MS";2011;413280;11785;0,0285157762291909;5007208;580592;361436,64;0,622531209524072
"PREF MUN DE RIO CASCA";"MG";2011;150180;0;0;3154903;188400;3215,67;0,0170683121019108
"PREF MUN DE RIO CLARO";"RJ";2011;187980;72456,21;0,385446377274178;3304409;223400;166560,02;0,745568576544315
"PREF MUN DE RIO CLARO";"SP";2011;2358660;73475,3;0,0311512892913773;3543907;2869660;704892,88;0,245636375040946
"PREF MUN DE RIO CRESPO";"RO";NA;NA;NA;NA;1100262;31100;0;0
"PREF MUN DE RIO DA CONCEICAO";"TO";2011;15600;0;0;1718659;29460;0;0
"PREF MUN DE RIO DAS ANTAS";"SC";2011;55620;13173,42;0,236846817691478;4214409;90100;30398,49;0,337386126526082
"PREF MUN DE RIO DAS FLORES";"RJ";2011;115440;0;0;3304508;150980;0;0
"PREF MUN DE RIO DAS OSTRAS";"RJ";2011;1116300;0;0;3304524;1385920;0;0
"PREF MUN DE RIO DAS PEDRAS";"SP";2011;431040;0;0;3544004;537640;198600;0,369392158321553
"PREF MUN DE RIO DE CONTAS";"BA";2011;106800;0;0;2926707;112180;25007,25;0,222920752362275
"PREF MUN DE RIO DE JANEIRO";"RJ";2011;50272170;0;0;3304557;67246814;445694,4;0,00662774001456783
"PREF MUN DE RIO DO ANTONIO";"BA";2011;189360;72304,85;0,381838033375581;2926806;202700;48586,8;0,239698075974346
"PREF MUN DE RIO DO CAMPO";"SC";2011;37800;14233,22;0,376540211640212;4214508;54720;20073,38;0,366838084795322
"PREF MUN DE RIO DO FOGO";"RN";2011;181200;54872,35;0,302827538631347;2408953;349684;44418,9;0,127025829034214
"PREF MUN DE RIO DO OESTE";"SC";2011;56940;23134,29;0,406292413066386;4214607;78060;35016,86;0,448589034076352
"PREF MUN DE RIO DO PIRES";"BA";2011;128880;29352,45;0,227750232774674;2926905;185496;36056,6;0,194379393625739
"PREF MUN DE RIO DO PRADO";"MG";2011;37680;7352,75;0,195136677282378;3155108;44200;9073;0,20527149321267
"PREF MUN DE RIO DO SUL";"SC";2011;492480;153933;0,312567007797271;4214805;972380;99422,99;0,102247053621012
"PREF MUN DE RIO DOCE";"MG";2011;17940;4403,3;0,245445930880714;3155009;17440;0;0
"PREF MUN DE RIO DOS BOIS";"TO";2011;18780;0;0;1718709;21080;0;0
"PREF MUN DE RIO DOS CEDROS";"SC";2011;70320;33433,55;0,475448663253697;4214706;99420;55009,45;0,553303661235164
"PREF MUN DE RIO DOS INDIOS";"RS";2011;27300;0;0;4315552;25440;4938,37;0,194118317610063
"PREF MUN DE RIO ESPERA";"MG";2011;15180;0;0;3155207;15560;3585;0,230398457583548
"PREF MUN DE RIO FORMOSO";"PE";2011;344880;4400;0,0127580607747622;2611903;430560;0;0
"PREF MUN DE RIO FORTUNA";"SC";2011;31740;0;0;4214904;47600;12755,16;0,267965546218487
"PREF MUN DE RIO GRANDE";"RS";2011;1342800;441425;0,32873473339291;4315602;1609520;378130;0,234933396292062
"PREF MUN DE RIO GRANDE DA SERRA";"SP";2011;43272;0;0;3544103;198920;0;0
"PREF MUN DE RIO GRANDE DO PIAUI";"PI";2011;58980;0;0;2209005;118552;0;0
"PREF MUN DE RIO LARGO";"AL";2011;827580;16534;0,0199787331738321;2707701;1014440;117263,66;0,115594475769883
"PREF MUN DE RIO MANSO";"MG";2011;30960;0;0;3155306;30860;0;0
"PREF MUN DE RIO MARIA";"PA";2011;267780;19559,3;0,0730424228844574;1506161;337274,4;35532,55;0,105352051623248
"PREF MUN DE RIO NEGRINHO";"SC";2011;510900;157572,08;0,308420591113721;4215000;644848;295502,37;0,458251200282857
"PREF MUN DE RIO NEGRO";"MS";2011;36480;9887,75;0,271045778508772;5007307;51420;25924,02;0,50416219369895
"PREF MUN DE RIO NEGRO";"PR";2011;227160;90181,02;0,396993396724776;4122305;359208;122870,56;0,342059642324224
"PREF MUN DE RIO NOVO";"MG";2011;65760;11344,96;0,172520681265207;3155405;75360;21089,5;0,279850053078556
"PREF MUN DE RIO NOVO DO SUL";"ES";2011;87060;10227,4;0,117475304387779;3204401;131140;31657,17;0,2413998017386
"PREF MUN DE RIO PARANAIBA";"MG";2011;96900;20366,3;0,210178534571723;3155504;117234;2142;0,018271150007677
"PREF MUN DE RIO PARDO";"RS";2011;132198;0;0;4315701;245940;137799,57;0,560297511588192
"PREF MUN DE RIO PARDO DE MINAS";"MG";2011;239880;77483,34;0,323008754377189;3155603;229160;99846,5;0,435706493279804
"PREF MUN DE RIO PIRACICABA";"MG";2011;117840;0;0;3155702;112720;50836,62;0,45099911284599
"PREF MUN DE RIO POMBA";"MG";2011;57180;16107,2;0,28169289961525;3155801;75500;17330,5;0,229543046357616
"PREF MUN DE RIO PRETO";"MG";2011;51240;20042,96;0,391158469945355;3155900;47106;0;0
"PREF MUN DE RIO PRETO DA EVA";"AM";2011;309420;0;0;1303569;466538,4;164190,76;0,351934074451321
"PREF MUN DE RIO QUENTE";"GO";2011;31920;13935,6;0,436578947368421;5218789;31680;9504;0,3
"PREF MUN DE RIO REAL";"BA";2011;530160;164722,25;0,310702901011016;2927002;743220;56215,1;0,0756372272005597
"PREF MUN DE RIO RUFINO";"SC";2011;17880;0;0;4215059;28332;10107,69;0,356758788648878
"PREF MUN DE RIO SONO";"TO";2011;40020;590;0,0147426286856572;1718758;62344;39851,11;0,639213236237649
"PREF MUN DE RIO TINTO";"PB";2011;268440;71877,33;0,267759387572642;2512903;410436;115013,46;0,280222641288776
"PREF MUN DE RIO VERDE";"GO";2011;1404900;0;0;5218805;1810960;691248,48;0,381702787471838
"PREF MUN DE RIO VERDE DE MATO GROSSO";"MS";2011;114480;35238,6;0,307814465408805;5007406;172500;19785,88;0,114700753623188
"PREF MUN DE RIO VERMELHO";"MG";2011;93780;6056;0,0645766687993175;3156007;111816;600;0,00536595836016313
"PREF MUN DE RIOLANDIA";"SP";2011;125820;2258,1;0,0179470672389127;3544202;247796;29464,05;0,118904461734653
"PREF MUN DE RIOZINHO";"RS";2011;45660;0;0;4315750;56800;25604,38;0,450781338028169
"PREF MUN DE RIQUEZA";"SC";2011;27960;9500,7;0,339796137339056;4215075;52880;6973,74;0,131878593040847
"PREF MUN DE RITAPOLIS";"MG";2011;27000;8614,88;0,31906962962963;3156106;29340;18476,3;0,629730743012952
"PREF MUN DE RIVERSUL";"SP";2011;97560;37654,66;0,385964124641246;3543501;91024;13118,13;0,144117265776059
"PREF MUN DE ROCA SALES";"RS";2011;76860;80630,94;1,04906245120999;4315800;95840;29176,74;0,304431761268781
"PREF MUN DE ROCHEDO";"MS";NA;NA;NA;NA;5007505;49220;6563,7;0,133354327509143
"PREF MUN DE ROCHEDO DE MINAS";"MG";2011;32340;0;0;3156205;35280;12724,59;0,360674319727891
"PREF MUN DE RODEIO";"SC";2011;63780;0;0;4215109;101340;36137,1;0,356592658377738
"PREF MUN DE RODEIO BONITO";"RS";2011;27540;16610,6;0,603144517066086;4315909;52100;29663,8;0,569362763915547
"PREF MUN DE RODEIRO";"MG";2011;37080;15893,35;0,428623247033441;3156304;45120;35305,93;0,782489583333333
"PREF MUN DE RODELAS";"BA";2011;86880;0;0;2927101;136700;26572,96;0,19438888076079
"PREF MUN DE RODOLFO FERNANDES";"RN";2011;71460;0;0;2411007;98520;11082;0,112484774665043
"PREF MUN DE RODRIGUES ALVES";"AC";2011;215820;32974;0,152784728014086;1200427;243122;67417,2;0,277297817556618
"PREF MUN DE ROLADOR";"RS";2011;9840;0;0;4315958;9540;1300,4;0,136310272536688
"PREF MUN DE ROLANDIA";"PR";2011;362220;54342,98;0,150027552316272;4122404;528768;96603,62;0,182695662369886
"PREF MUN DE ROLANTE";"RS";2011;202140;100047,98;0,494943999208469;4316006;297060;119947,6;0,403782400861779
"PREF MUN DE ROLIM DE MOURA";"RO";2011;262980;82260,09;0,312799794661191;1100288;339450;107041,36;0,315337634408602
"PREF MUN DE ROMARIA";"MG";2011;25560;3508,26;0,137255868544601;3156403;26760;0;0
"PREF MUN DE ROMELANDIA";"SC";2011;28260;11766,25;0,416357041755131;4215208;33740;11246,6;0,333331357439241
"PREF MUN DE RONCADOR";"PR";2011;86880;0;0;4122503;138068;40413,6;0,292707941014573
"PREF MUN DE RONDA ALTA";"RS";2011;29160;17429,75;0,5977280521262;4316105;55920;16382,35;0,29296047925608
"PREF MUN DE RONDINHA";"RS";2011;31500;11799,9;0,3746;4316204;42380;13917,68;0,328402076451156
"PREF MUN DE RONDOLANDIA";"MT";2011;58560;0;0;5107578;44128;0;0
"PREF MUN DE RONDON";"PR";2011;71160;28080,46;0,3946101742552;4122602;101940;40665,65;0,398917500490485
"PREF MUN DE RONDON DO PARA";"PA";2011;733320;108443,3;0,147879915998473;1506187;849140;94271,95;0,111020503097251
"PREF MUN DE RONDONOPOLIS";"MT";2011;1238040;4050,28;0,003271525960389;5107602;1697532;0;0
"PREF MUN DE ROQUE GONZALES";"RS";2011;41280;13802,46;0,334361918604651;4316303;52240;32687,36;0,625715160796325
"PREF MUN DE RORAINOPOLIS";"RR";2011;267660;32441;0,121202271538519;1400472;372000;98650,09;0,265188413978495
"PREF MUN DE ROSANA";"SP";2011;310140;93371,14;0,301061262655575;3544251;368100;86570,16;0,23518109209454
"PREF MUN DE ROSARIO";"MA";NA;NA;NA;NA;2109601;729360;145334,75;0,199263395305473
"PREF MUN DE ROSARIO DA LIMEIRA";"MG";2011;55920;30032,07;0,537054184549356;3156452;64100;3620,25;0,0564781591263651
"PREF MUN DE ROSARIO DO CATETE";"SE";2011;127320;15471,18;0,121514137606032;2806107;184480;95315,86;0,516673135299219
"PREF MUN DE ROSARIO DO IVAI";"PR";2011;43800;29192,81;0,666502511415525;4122651;55160;18262,23;0,331077411167513
"PREF MUN DE ROSARIO DO SUL";"RS";2011;183600;24120,2;0,131373638344227;4316402;225660;19590,19;0,0868128600549499
"PREF MUN DE ROSARIO OESTE";"MT";2011;123300;0;0;5107701;132894;0;0
"PREF MUN DE ROSEIRA";"SP";2011;152220;0;0;3544301;210360;0;0
"PREF MUN DE ROTEIRO";"AL";NA;NA;NA;NA;2707800;91970;0;0
"PREF MUN DE RUBELITA";"MG";2011;52020;9287,1;0,178529411764706;3156502;62860;21701,7;0,345238625517022
"PREF MUN DE RUBIACEA";"SP";2011;10044;0;0;3544400;66080;0;0
"PREF MUN DE RUBIATABA";"GO";2011;122160;29657,41;0,242775130975769;5218904;172840;51378,05;0,297257868548947
"PREF MUN DE RUBIM";"MG";2011;93420;4207,68;0,0450404624277457;3156601;132540;28981,5;0,218662290629244
"PREF MUN DE RUBINEIA";"SP";2011;41040;6280,37;0,153030458089669;3544509;122480;18021,91;0,147141655780536
"PREF MUN DE RUROPOLIS";"PA";NA;NA;NA;NA;1506195;692646;0;0
"PREF MUN DE RUSSAS";"CE";2011;856740;276913,84;0,323218059154469;2311801;2162956;768142,5;0,355135518244477
"PREF MUN DE RUY BARBOSA";"BA";2011;383640;80327,17;0,209381633823376;2927200;599728;174542,99;0,291036920070432
"PREF MUN DE RUY BARBOSA";"RN";2011;56940;13000;0,228310502283105;2411106;89904;27418;0,304969745506318
"PREF MUN DE SABARA";"MG";2011;1505460;24859,5;0,016512893069228;3156700;1656572;9025,73;0,00544843809988337
"PREF MUN DE SABAUDIA";"PR";2011;45780;13770;0,300786369593709;4122701;70700;16478;0,233069306930693
"PREF MUN DE SABINO";"SP";2011;82080;0;0;3544608;99900;42139,22;0,421814014014014
"PREF MUN DE SABINOPOLIS";"MG";2011;87360;0;0;3156809;100260;11968,75;0,119377119489328
"PREF MUN DE SABOEIRO";"CE";2011;276000;13089,5;0,0474257246376812;2311900;335740;127160;0,378745457794722
"PREF MUN DE SACRAMENTO";"MG";2011;133440;35851,97;0,268674835131894;3156908;180100;55444,12;0,307851860077735
"PREF MUN DE SAGRADA FAMILIA";"RS";2011;13800;0;0;4316428;20440;4857,5;0,237646771037182
"PREF MUN DE SAGRES";"SP";2011;39600;0;0;3544707;9060;0;0
"PREF MUN DE SAIRE";"PE";2011;162900;0;0;2612000;190768;0;0
"PREF MUN DE SALDANHA MARINHO";"RS";2011;21060;6412,6;0,304491927825261;4316436;23976;7670,65;0,31993034701368
"PREF MUN DE SALES";"SP";2011;74820;0;0;3544806;75402;0;0
"PREF MUN DE SALES OLIVEIRA";"SP";2011;127560;0;0;3544905;121032;0;0
"PREF MUN DE SALESOPOLIS";"SP";2011;257580;0;0;3545001;187208;0;0
"PREF MUN DE SALETE";"SC";2011;61320;28849,06;0,47046738421396;4215307;69540;33263,82;0,478340811044003
"PREF MUN DE SALGADINHO";"PB";2011;51480;16136,49;0,313451631701632;2513000;83812;13506;0,161146375220732
"PREF MUN DE SALGADINHO";"PE";2011;89880;0;0;2612109;97710;6539;0,0669225258417767
"PREF MUN DE SALGADO";"SE";2011;197940;11252;0,0568455087400222;2806206;209040;51054,78;0,244234500574053
"PREF MUN DE SALGADO DE SAO FELIX";"PB";2011;164640;0;0;2513109;266940;67687;0,253566344496891
"PREF MUN DE SALGADO FILHO";"PR";2011;43680;13787,55;0,315649038461538;4122800;42640;18493,12;0,433703564727955
"PREF MUN DE SALGUEIRO";"PE";2011;453540;136096,74;0,300076597433523;2612208;651552;45101,92;0,0692222877068906
"PREF MUN DE SALINAS";"MG";2011;167460;0;0;3157005;214540;64748;0,301799198284702
"PREF MUN DE SALINAS DA MARGARIDA";"BA";2011;285300;49701,49;0,174207816333684;2927309;351544;100251,42;0,285174601187902
"PREF MUN DE SALINOPOLIS";"PA";NA;NA;NA;NA;1506203;940420;322342,29;0,342764179834542
"PREF MUN DE SALITRE";"CE";2011;360180;197713,83;0,548930618024321;2311959;516386,4;386890,6;0,749226935488619
"PREF MUN DE SALMOURAO";"SP";2011;77280;0;0;3545100;73240;18410,09;0,251366602949208
"PREF MUN DE SALOA";"PE";2011;262680;66062,6;0,251494594183036;2612307;476688;76273,87;0,160007950693116
"PREF MUN DE SALTINHO";"SC";2011;27540;7500,49;0,272348946986202;4215356;34260;13989,2;0,408324576765908
"PREF MUN DE SALTINHO";"SP";2011;84000;0;0;3545159;115740;0;0
"PREF MUN DE SALTO";"SP";2011;1385280;0;0;3545209;1690060;446678,14;0,264297208383134
"PREF MUN DE SALTO DA DIVISA";"MG";2011;66240;15584,65;0,235275513285024;3157104;85824;67377,4;0,785064783743475
"PREF MUN DE SALTO DE PIRAPORA";"SP";2011;574500;0;0;3545308;637780;0;0
"PREF MUN DE SALTO DO CEU";"MT";2011;36000;0;0;5107750;46100;12888,35;0,279573752711497
"PREF MUN DE SALTO DO ITARARE";"PR";2011;24948;0;0;4122909;47440;0;0
"PREF MUN DE SALTO DO JACUI";"RS";2011;88500;19741,86;0,22307186440678;4316451;119380;35975,7;0,301354498240911
"PREF MUN DE SALTO DO LONTRA";"PR";2011;97200;29494,6;0,303442386831276;4123006;127000;34407,56;0,270925669291339
"PREF MUN DE SALTO GRANDE";"SP";2011;123540;0;0;3545407;155300;58002,63;0,373487636831938
"PREF MUN DE SALTO VELOSO";"SC";2011;55860;11156,56;0,199723594701038;4215406;73440;25423,09;0,346174972766885
"PREF MUN DE SALVADOR";"BA";2011;13148760;266380;0,0202589445696781;2927408;14078908;508744,6;0,036135231510853
"PREF MUN DE SALVADOR DAS MISSOES";"RS";2011;12060;7326,79;0,607528192371476;4316477;10180;8292,07;0,814545186640471
"PREF MUN DE SALVADOR DO SUL";"RS";2011;42540;0;0;4316501;65000;33483,87;0,515136461538462
"PREF MUN DE SALVATERRA";"PA";2011;401700;30277;0,0753721682847896;1506302;457434;58547;0,127990048837647
"PREF MUN DE SAMBAIBA";"MA";2011;80880;0;0;2109700;95260;29062,48;0,305085870249843
"PREF MUN DE SAMPAIO";"TO";2011;40620;13810;0,339980305268341;1718808;58840;4069;0,0691536369816451
"PREF MUN DE SANANDUVA";"RS";2011;182280;56185,78;0,30823886328725;4316600;239060;47812,95;0,200003973897766
"PREF MUN DE SANCLERLANDIA";"GO";2011;37440;24450,53;0,653059027777778;5219001;60620;45245,77;0,746383536786539
"PREF MUN DE SANDOLANDIA";"TO";2011;18000;0;0;1718840;25260;25041,38;0,991345209817894
"PREF MUN DE SANDOVALINA";"SP";2011;75996;5328,95;0,0701214537607242;3545506;57806;0;0
"PREF MUN DE SANGAO";"SC";2011;56520;23847,12;0,421923566878981;4215455;90060;58014,89;0,644180435265379
"PREF MUN DE SANHARO";"PE";2011;283560;0;0;2612406;374274,4;37125,47;0,0991931855344635
"PREF MUN DE SANTA ADELIA";"SP";2011;177300;0;0;3545605;195300;0;0
"PREF MUN DE SANTA ALBERTINA";"SP";2011;62340;0;0;3545704;118660;0;0
"PREF MUN DE SANTA AMELIA";"PR";2011;33240;9974,93;0,300088146811071;4123105;43968;16239,09;0,369338837336245
"PREF MUN DE SANTA BARBARA";"BA";2011;216900;0;0;2927507;379888;74117,15;0,195102635513625
"PREF MUN DE SANTA BARBARA";"MG";2011;235860;82013,4;0,347720681760366;3157203;243000;99697,66;0,410278436213992
"PREF MUN DE SANTA BARBARA DE GOIAS";"GO";2011;42480;0;0;5219100;67780;0;0
"PREF MUN DE SANTA BARBARA DO LESTE";"MG";2011;60720;28612,87;0,471226449275362;3157252;65480;5785,1;0,0883491142333537
"PREF MUN DE SANTA BARBARA DO MONTE VERDE";"MG";2011;34320;0;0;3157278;35940;5172,95;0,143932943795214
"PREF MUN DE SANTA BARBARA DO PARA";"PA";2011;221340;62496,8;0,282356555525436;1506351;334780;51047,95;0,152482077782424
"PREF MUN DE SANTA BARBARA DO SUL";"RS";2011;73860;23511,8;0,318329271594909;4316709;112440;38573,4;0,343057630736393
"PREF MUN DE SANTA BARBARA DO TUGURIO";"MG";2011;36240;11893;0,328173289183223;3157302;39140;6348,11;0,162189831374553
"PREF MUN DE SANTA BARBARA DOESTE";"SP";2011;2277480;653800,55;0,287071917206737;3545803;2940440;946904,55;0,322028182856987
"PREF MUN DE SANTA BRANCA";"SP";2011;196560;0;0;3546009;305996;0;0
"PREF MUN DE SANTA BRIGIDA";"BA";2011;258540;0;0;2927606;271300;0;0
"PREF MUN DE SANTA CARMEM";"MT";2011;66900;27744,41;0,414714648729447;5107248;78740;36851;0,468008636017272
"PREF MUN DE SANTA CECILIA";"PB";2011;100380;17298,25;0,172327654911337;2513158;123297,6;21387,5;0,173462419382048
"PREF MUN DE SANTA CECILIA";"SC";2011;117900;3529,88;0,0299396098388465;4215505;158000;44428,55;0,28119335443038
"PREF MUN DE SANTA CECILIA DO PAVAO";"PR";2011;34620;0;0;4123204;14364;0;0
"PREF MUN DE SANTA CECILIA DO SUL";"RS";2011;12300;1961,75;0,159491869918699;4316733;10746;5423,55;0,504704075935232
"PREF MUN DE SANTA CLARA DO SUL";"RS";2011;37260;10570,56;0,283697262479871;4316758;62876,8;28974,5;0,46081384548832
"PREF MUN DE SANTA CLARA DOESTE";"SP";2011;30600;9183,8;0,300124183006536;3546108;67900;22377,76;0,329569366715758
"PREF MUN DE SANTA CRUZ";"PB";2011;51180;5898;0,115240328253224;2513208;92628;6241,25;0,0673797339897223
"PREF MUN DE SANTA CRUZ";"PE";2011;251580;21904;0,0870657444947929;2612455;334508;33039;0,0987689382615662
"PREF MUN DE SANTA CRUZ";"RN";2011;256500;137801;0,537235867446394;2411205;384544;103400,09;0,268890140009986
"PREF MUN DE SANTA CRUZ CABRALIA";"BA";2011;489540;0;0;2927705;652856;50327,8;0,0770886688641906
"PREF MUN DE SANTA CRUZ DA BAIXA VERDE";"PE";2011;110400;47568,38;0,430873007246377;2612471;240304;29835;0,12415523670018
"PREF MUN DE SANTA CRUZ DA CONCEICAO";"SP";2011;56940;20449,2;0,35913593256059;3546207;105420;13866,46;0,131535382280402
"PREF MUN DE SANTA CRUZ DA ESPERANCA";"SP";2011;34200;0;0;3546256;38440;0;0
"PREF MUN DE SANTA CRUZ DA VITORIA";"BA";2011;111660;31428,75;0,281468296614723;2927804;136180;39727;0,291724188573946
"PREF MUN DE SANTA CRUZ DAS PALMEIRAS";"SP";2011;425700;22022,72;0,0517329574817947;3546306;458012;163426,34;0,356816720959276
"PREF MUN DE SANTA CRUZ DE GOIAS";"GO";2011;22248;0;0;5219209;16880;0;0
"PREF MUN DE SANTA CRUZ DE MINAS";"MG";2011;30360;0;0;3157336;29970;0;0
"PREF MUN DE SANTA CRUZ DE MONTE CASTELO";"PR";2011;60420;21265,55;0,351962098642834;4123303;87380;26409,33;0,302235408560311
"PREF MUN DE SANTA CRUZ DE SALINAS";"MG";2011;25590;0;0;3157377;43296;17937,96;0,414309866962306
"PREF MUN DE SANTA CRUZ DO ARARI";"PA";2011;122820;0;0;1506401;173716;64171,46;0,369404430219439
"PREF MUN DE SANTA CRUZ DO CAPIBARIBE";"PE";2011;628680;0;0;2612505;938296;0;0
"PREF MUN DE SANTA CRUZ DO ESCALVADO";"MG";2011;39600;19245,4;0,48599494949495;3157401;38020;13837,4;0,363950552340873
"PREF MUN DE SANTA CRUZ DO PIAUI";"PI";2011;57960;3469;0,0598516218081435;2209104;92560;29712;0,321002592912705
"PREF MUN DE SANTA CRUZ DO RIO PARDO";"SP";2011;573060;0;0;3546405;801460;257563,72;0,321368153120555
"PREF MUN DE SANTA CRUZ DO SUL";"RS";2011;889620;315327,61;0,354452024459882;4316808;1329776;436535,6;0,328277544488696
"PREF MUN DE SANTA CRUZ DO XINGU";"MT";2011;31320;0;0;5107743;37332;0;0
"PREF MUN DE SANTA CRUZ DOS MILAGRES";"PI";2011;53340;0;0;2209153;69580;3573,4;0,051356711698764
"PREF MUN DE SANTA EFIGENIA DE MINAS";"MG";2011;28740;0;0;3157500;34460;0;0
"PREF MUN DE SANTA ERNESTINA";"SP";2011;88740;0;0;3546504;106520;21420,57;0,201094348479159
"PREF MUN DE SANTA FE";"PR";2011;79080;0;0;4123402;121900;0;0
